01-08-2019 12:44:32 INFO:***************** Starting Cadastron v2.138 Build: 01-08-2019-12:04:56 *****************
01-08-2019 12:44:32 DEBUG:Initializing WebSocket
01-08-2019 12:44:32 DEBUG:Validating WebSocket request
01-08-2019 12:44:32 INFO:127.0.0.1 - - [2019-08-01 12:44:32] "GET /eel.js HTTP/1.1" 200 4803 0.000998
01-08-2019 12:44:32 DEBUG:Initializing WebSocket
01-08-2019 12:44:32 DEBUG:Validating WebSocket request
01-08-2019 12:44:32 DEBUG:Attempting to upgrade connection
01-08-2019 12:44:32 DEBUG:WebSocket request accepted, switching protocols
01-08-2019 12:44:34 DEBUG:Closed WebSocket
01-08-2019 12:44:35 DEBUG:Failed to write closing frame -> closing socket
01-08-2019 12:44:35 DEBUG:Closed WebSocket
01-08-2019 12:46:05 INFO:***************** Starting Cadastron v2.138 Build: 01-08-2019-12:04:56 *****************
01-08-2019 12:46:05 DEBUG:Initializing WebSocket
01-08-2019 12:46:05 DEBUG:Validating WebSocket request
01-08-2019 12:46:05 INFO:127.0.0.1 - - [2019-08-01 12:46:05] "GET /eel.js HTTP/1.1" 200 4803 0.000000
01-08-2019 12:46:06 DEBUG:Initializing WebSocket
01-08-2019 12:46:06 DEBUG:Validating WebSocket request
01-08-2019 12:46:06 DEBUG:Attempting to upgrade connection
01-08-2019 12:46:06 DEBUG:WebSocket request accepted, switching protocols
01-08-2019 12:46:08 DEBUG:Closed WebSocket
01-08-2019 12:46:09 DEBUG:Failed to write closing frame -> closing socket
01-08-2019 12:46:09 DEBUG:Closed WebSocket
01-08-2019 04:23:27 INFO:***************** Starting Cadastron v2.141 Build: 01-08-2019-14:20:34 *****************
01-08-2019 04:23:27 DEBUG:Initializing WebSocket
01-08-2019 04:23:27 DEBUG:Validating WebSocket request
01-08-2019 04:23:27 INFO:127.0.0.1 - - [2019-08-01 16:23:27] "GET /eel.js HTTP/1.1" 200 4803 0.000998
01-08-2019 04:23:28 DEBUG:Initializing WebSocket
01-08-2019 04:23:28 DEBUG:Validating WebSocket request
01-08-2019 04:23:28 DEBUG:Attempting to upgrade connection
01-08-2019 04:23:28 DEBUG:WebSocket request accepted, switching protocols
01-08-2019 04:23:40 DEBUG:Введенный кад. номер: 66192501001172
01-08-2019 04:23:40 DEBUG:Starting new HTTP connection (1): pkk5.rosreestr.ru:80
01-08-2019 04:23:40 DEBUG:http://pkk5.rosreestr.ru:80 "POST /api/features/1/66:19:2501001:172 HTTP/1.1" 301 0
01-08-2019 04:23:40 DEBUG:Starting new HTTPS connection (1): pkk5.rosreestr.ru:443
01-08-2019 04:23:40 DEBUG:https://pkk5.rosreestr.ru:443 "GET /api/features/1/66:19:2501001:172 HTTP/1.1" 200 2389
01-08-2019 04:23:40 INFO:Кадастровый номер: 66:19:2501001:172
Адрес: Свердловская область, Пригородный район, поселок Молодежный, улица Совхозная, участок 34 А
Координаты:
58,008224	60,302817
58°00ʹ29ʺ с.ш. 60°18ʹ10ʺ в.д.
Лист М 1:200000 : O-41-13

https://yandex.ru/maps/?mode=search&text=58.008224%2C60.302817

file://d:/OziExplorer/data/CADASTER.txt
Datum,WGS 84
WP,D,66:19:2501001:172,58.008224,60.302817,08/01/19,16/23/40,,D,N,-9999

01-08-2019 04:25:21 DEBUG:Адрес:Свердловская область, Пригородный район, поселок Молодежный, улица Совхозная, участок 34 А
01-08-2019 04:25:21 DEBUG:Папка с отчетом:Н.Тагил, Молодежный, ул Совхозная, уч 34А Август 2019
01-08-2019 04:30:43 DEBUG:Closed WebSocket
01-08-2019 04:30:44 DEBUG:Failed to write closing frame -> closing socket
01-08-2019 04:30:44 DEBUG:Closed WebSocket
02-08-2019 04:51:55 INFO:******************** Starting Cadastron v2.141 Build: 01-08-2019-14:20:34 ********************
02-08-2019 04:51:56 DEBUG:Initializing WebSocket
02-08-2019 04:51:56 DEBUG:Validating WebSocket request
02-08-2019 04:51:56 INFO:127.0.0.1 - - [2019-08-02 16:51:56] "GET /main-uikit.html HTTP/1.1" 200 9516 0.336166
02-08-2019 04:51:56 DEBUG:Initializing WebSocket
02-08-2019 04:51:56 DEBUG:Validating WebSocket request
02-08-2019 04:51:56 INFO:127.0.0.1 - - [2019-08-02 16:51:56] "GET /css/uikit.min.css HTTP/1.1" 200 253541 0.014960
02-08-2019 04:51:56 DEBUG:Initializing WebSocket
02-08-2019 04:51:56 DEBUG:Validating WebSocket request
02-08-2019 04:51:56 INFO:127.0.0.1 - - [2019-08-02 16:51:56] "GET /css/leaflet.css HTTP/1.1" 200 14292 0.019945
02-08-2019 04:51:56 DEBUG:Initializing WebSocket
02-08-2019 04:51:56 DEBUG:Validating WebSocket request
02-08-2019 04:51:56 INFO:127.0.0.1 - - [2019-08-02 16:51:56] "GET /css/main-uikit.css HTTP/1.1" 200 556 0.001996
02-08-2019 04:51:56 DEBUG:Initializing WebSocket
02-08-2019 04:51:56 DEBUG:Validating WebSocket request
02-08-2019 04:51:56 INFO:127.0.0.1 - - [2019-08-02 16:51:56] "GET /js/uikit-icons.min.js HTTP/1.1" 200 63621 0.000997
02-08-2019 04:51:56 DEBUG:Initializing WebSocket
02-08-2019 04:51:56 DEBUG:Validating WebSocket request
02-08-2019 04:51:56 INFO:127.0.0.1 - - [2019-08-02 16:51:56] "GET /js/jquery-3.3.1.min.js HTTP/1.1" 200 87114 0.000998
02-08-2019 04:51:56 DEBUG:Initializing WebSocket
02-08-2019 04:51:56 DEBUG:Validating WebSocket request
02-08-2019 04:51:56 INFO:127.0.0.1 - - [2019-08-02 16:51:56] "GET /js/uikit.min.js HTTP/1.1" 200 132179 0.000000
02-08-2019 04:51:56 DEBUG:Initializing WebSocket
02-08-2019 04:51:56 DEBUG:Validating WebSocket request
02-08-2019 04:51:56 INFO:127.0.0.1 - - [2019-08-02 16:51:56] "GET /js/leaflet.js HTTP/1.1" 200 141315 0.000998
02-08-2019 04:51:56 DEBUG:Initializing WebSocket
02-08-2019 04:51:56 DEBUG:Validating WebSocket request
02-08-2019 04:51:56 INFO:127.0.0.1 - - [2019-08-02 16:51:56] "GET /eel.js HTTP/1.1" 200 4803 0.000998
02-08-2019 04:51:56 DEBUG:Initializing WebSocket
02-08-2019 04:51:56 DEBUG:Validating WebSocket request
02-08-2019 04:51:56 INFO:127.0.0.1 - - [2019-08-02 16:51:56] "GET /js/script-uikit.js HTTP/1.1" 200 12495 0.000997
02-08-2019 04:51:56 DEBUG:Initializing WebSocket
02-08-2019 04:51:56 DEBUG:Validating WebSocket request
02-08-2019 04:51:56 INFO:127.0.0.1 - - [2019-08-02 16:51:56] "GET /favicon.ico HTTP/1.1" 200 15261 0.017951
02-08-2019 04:51:57 DEBUG:Initializing WebSocket
02-08-2019 04:51:57 DEBUG:Validating WebSocket request
02-08-2019 04:51:57 INFO:127.0.0.1 - - [2019-08-02 16:51:57] "GET /css/images/marker-icon.png HTTP/1.1" 200 1637 0.004997
02-08-2019 04:51:57 DEBUG:Initializing WebSocket
02-08-2019 04:51:57 DEBUG:Validating WebSocket request
02-08-2019 04:51:57 INFO:127.0.0.1 - - [2019-08-02 16:51:57] "GET /css/images/marker-shadow.png HTTP/1.1" 200 788 0.002992
02-08-2019 04:51:57 DEBUG:Initializing WebSocket
02-08-2019 04:51:57 DEBUG:Validating WebSocket request
02-08-2019 04:51:57 DEBUG:Attempting to upgrade connection
02-08-2019 04:51:57 DEBUG:WebSocket request accepted, switching protocols
02-08-2019 04:51:59 DEBUG:Введенный кад. номер: 74090607001634
02-08-2019 04:51:59 DEBUG:Starting new HTTP connection (1): pkk5.rosreestr.ru:80
02-08-2019 04:51:59 DEBUG:http://pkk5.rosreestr.ru:80 "POST /api/features/1/74:9:607001:634 HTTP/1.1" 301 0
02-08-2019 04:51:59 DEBUG:Starting new HTTPS connection (1): pkk5.rosreestr.ru:443
02-08-2019 04:51:59 DEBUG:https://pkk5.rosreestr.ru:443 "GET /api/features/1/74:9:607001:634 HTTP/1.1" 200 2184
02-08-2019 04:51:59 INFO:Кадастровый номер: 74:09:0607001:634
Адрес: Челябинская область, р-н Каслинский, д. Григорьевка, ул. Березовая, 5
Координаты:
56,162464	60,915409
56°09ʹ44ʺ с.ш. 60°54ʹ55ʺ в.д.
Лист М 1:200000 : O-41-31

https://yandex.ru/maps/?mode=search&text=56.162464%2C60.915409

file://d:/OziExplorer/data/CADASTER.txt
Datum,WGS 84
WP,D,74:09:0607001:634,56.162464,60.915409,08/02/19,16/51/59,,D,N,-9999

02-08-2019 04:52:09 DEBUG:Closed WebSocket
02-08-2019 04:52:10 DEBUG:Failed to write closing frame -> closing socket
02-08-2019 04:52:10 DEBUG:Closed WebSocket
02-08-2019 04:57:10 INFO:******************** Starting Cadastron v2.142 Build: 02-08-2019-16:56:25 ********************
02-08-2019 04:57:10 DEBUG:Initializing WebSocket
02-08-2019 04:57:10 DEBUG:Validating WebSocket request
02-08-2019 04:57:10 INFO:127.0.0.1 - - [2019-08-02 16:57:10] "GET /eel.js HTTP/1.1" 200 4803 0.000000
02-08-2019 04:57:10 DEBUG:Initializing WebSocket
02-08-2019 04:57:10 DEBUG:Validating WebSocket request
02-08-2019 04:57:10 DEBUG:Attempting to upgrade connection
02-08-2019 04:57:10 DEBUG:WebSocket request accepted, switching protocols
02-08-2019 04:57:12 DEBUG:Введенный кад. номер: 74090607001634
02-08-2019 04:57:12 DEBUG:Starting new HTTP connection (1): pkk5.rosreestr.ru:80
02-08-2019 04:57:12 DEBUG:http://pkk5.rosreestr.ru:80 "POST /api/features/1/74:9:607001:634 HTTP/1.1" 301 0
02-08-2019 04:57:12 DEBUG:Starting new HTTPS connection (1): pkk5.rosreestr.ru:443
02-08-2019 04:57:12 DEBUG:https://pkk5.rosreestr.ru:443 "GET /api/features/1/74:9:607001:634 HTTP/1.1" 200 2184
02-08-2019 04:57:12 INFO:Кадастровый номер: 74:09:0607001:634
Адрес: Челябинская область, р-н Каслинский, д. Григорьевка, ул. Березовая, 5
Координаты:
56,162464	60,915409
56°09ʹ44ʺ с.ш. 60°54ʹ55ʺ в.д.
Лист М 1:200000 : O-41-31

https://yandex.ru/maps/?mode=search&text=56.162464%2C60.915409

file://d:/OziExplorer/data/CADASTER.txt
Datum,WGS 84
WP,D,74:09:0607001:634,56.162464,60.915409,08/02/19,16/57/12,,D,N,-9999

02-08-2019 04:57:17 DEBUG:Closed WebSocket
02-08-2019 04:57:18 DEBUG:Failed to write closing frame -> closing socket
02-08-2019 04:57:18 DEBUG:Closed WebSocket
06-08-2019 08:27:33 INFO:******************** Starting Cadastron v2.142 Build: 02-08-2019-16:56:25 ********************
06-08-2019 08:27:34 DEBUG:Initializing WebSocket
06-08-2019 08:27:34 DEBUG:Validating WebSocket request
06-08-2019 08:27:34 INFO:127.0.0.1 - - [2019-08-06 08:27:34] "GET /main-uikit.html HTTP/1.1" 200 9516 0.311289
06-08-2019 08:27:34 DEBUG:Initializing WebSocket
06-08-2019 08:27:34 DEBUG:Validating WebSocket request
06-08-2019 08:27:34 INFO:127.0.0.1 - - [2019-08-06 08:27:34] "GET /css/uikit.min.css HTTP/1.1" 200 253541 0.006982
06-08-2019 08:27:34 DEBUG:Initializing WebSocket
06-08-2019 08:27:34 DEBUG:Validating WebSocket request
06-08-2019 08:27:34 INFO:127.0.0.1 - - [2019-08-06 08:27:34] "GET /css/leaflet.css HTTP/1.1" 200 14292 0.020945
06-08-2019 08:27:34 DEBUG:Initializing WebSocket
06-08-2019 08:27:34 DEBUG:Validating WebSocket request
06-08-2019 08:27:34 INFO:127.0.0.1 - - [2019-08-06 08:27:34] "GET /css/main-uikit.css HTTP/1.1" 200 556 0.001994
06-08-2019 08:27:34 DEBUG:Initializing WebSocket
06-08-2019 08:27:34 DEBUG:Validating WebSocket request
06-08-2019 08:27:34 INFO:127.0.0.1 - - [2019-08-06 08:27:34] "GET /js/uikit-icons.min.js HTTP/1.1" 200 63621 0.000000
06-08-2019 08:27:34 DEBUG:Initializing WebSocket
06-08-2019 08:27:34 DEBUG:Validating WebSocket request
06-08-2019 08:27:34 INFO:127.0.0.1 - - [2019-08-06 08:27:34] "GET /js/jquery-3.3.1.min.js HTTP/1.1" 200 87114 0.000995
06-08-2019 08:27:34 DEBUG:Initializing WebSocket
06-08-2019 08:27:34 DEBUG:Validating WebSocket request
06-08-2019 08:27:34 INFO:127.0.0.1 - - [2019-08-06 08:27:34] "GET /js/uikit.min.js HTTP/1.1" 200 132179 0.000998
06-08-2019 08:27:34 DEBUG:Initializing WebSocket
06-08-2019 08:27:34 DEBUG:Validating WebSocket request
06-08-2019 08:27:34 INFO:127.0.0.1 - - [2019-08-06 08:27:34] "GET /js/leaflet.js HTTP/1.1" 200 141315 0.000998
06-08-2019 08:27:34 DEBUG:Initializing WebSocket
06-08-2019 08:27:34 DEBUG:Validating WebSocket request
06-08-2019 08:27:34 INFO:127.0.0.1 - - [2019-08-06 08:27:34] "GET /eel.js HTTP/1.1" 200 4803 0.000000
06-08-2019 08:27:34 DEBUG:Initializing WebSocket
06-08-2019 08:27:34 DEBUG:Validating WebSocket request
06-08-2019 08:27:34 INFO:127.0.0.1 - - [2019-08-06 08:27:34] "GET /js/script-uikit.js HTTP/1.1" 200 12495 0.000997
06-08-2019 08:27:34 DEBUG:Initializing WebSocket
06-08-2019 08:27:34 DEBUG:Validating WebSocket request
06-08-2019 08:27:34 INFO:127.0.0.1 - - [2019-08-06 08:27:34] "GET /favicon.ico HTTP/1.1" 200 15261 0.019977
06-08-2019 08:27:34 DEBUG:Initializing WebSocket
06-08-2019 08:27:34 DEBUG:Validating WebSocket request
06-08-2019 08:27:34 INFO:127.0.0.1 - - [2019-08-06 08:27:34] "GET /css/images/marker-icon.png HTTP/1.1" 200 1637 0.023924
06-08-2019 08:27:34 DEBUG:Initializing WebSocket
06-08-2019 08:27:34 DEBUG:Validating WebSocket request
06-08-2019 08:27:34 INFO:127.0.0.1 - - [2019-08-06 08:27:34] "GET /css/images/marker-shadow.png HTTP/1.1" 200 788 0.002022
06-08-2019 08:27:35 DEBUG:Initializing WebSocket
06-08-2019 08:27:35 DEBUG:Validating WebSocket request
06-08-2019 08:27:35 DEBUG:Attempting to upgrade connection
06-08-2019 08:27:35 DEBUG:WebSocket request accepted, switching protocols
06-08-2019 08:27:39 DEBUG:Введенный кад. номер: 66582902030122
06-08-2019 08:27:39 DEBUG:Starting new HTTP connection (1): pkk5.rosreestr.ru:80
06-08-2019 08:27:39 DEBUG:http://pkk5.rosreestr.ru:80 "POST /api/features/1/66:58:2902030:122 HTTP/1.1" 301 0
06-08-2019 08:27:39 DEBUG:Starting new HTTPS connection (1): pkk5.rosreestr.ru:443
06-08-2019 08:27:39 DEBUG:https://pkk5.rosreestr.ru:443 "GET /api/features/1/66:58:2902030:122 HTTP/1.1" 200 2083
06-08-2019 08:27:39 INFO:Кадастровый номер: 66:58:2902030:122
Адрес: Свердловская обл, г Первоуральск, в 0,5 км на юго-восток от села Новоалексеевское
Координаты:
56,837006	60,158449
56°50ʹ13ʺ с.ш. 60°09ʹ30ʺ в.д.
Лист М 1:200000 : O-41-25

https://yandex.ru/maps/?mode=search&text=56.837006%2C60.158449

file://d:/OziExplorer/data/CADASTER.txt
Datum,WGS 84
WP,D,66:58:2902030:122,56.837006,60.158449,08/06/19,08/27/39,,D,N,-9999

06-08-2019 11:12:56 DEBUG:Closed WebSocket
06-08-2019 11:12:57 DEBUG:Failed to write closing frame -> closing socket
06-08-2019 11:12:57 DEBUG:Closed WebSocket
06-08-2019 12:47:31 INFO:******************** Starting Cadastron v2.142 Build: 02-08-2019-16:56:25 ********************
06-08-2019 12:47:32 DEBUG:Initializing WebSocket
06-08-2019 12:47:32 DEBUG:Validating WebSocket request
06-08-2019 12:47:32 INFO:127.0.0.1 - - [2019-08-06 12:47:32] "GET /main-uikit.html HTTP/1.1" 200 9516 0.338058
06-08-2019 12:47:32 DEBUG:Initializing WebSocket
06-08-2019 12:47:32 DEBUG:Validating WebSocket request
06-08-2019 12:47:32 INFO:127.0.0.1 - - [2019-08-06 12:47:32] "GET /css/uikit.min.css HTTP/1.1" 200 253541 0.003989
06-08-2019 12:47:32 DEBUG:Initializing WebSocket
06-08-2019 12:47:32 DEBUG:Validating WebSocket request
06-08-2019 12:47:32 INFO:127.0.0.1 - - [2019-08-06 12:47:32] "GET /css/leaflet.css HTTP/1.1" 200 14292 0.001995
06-08-2019 12:47:32 DEBUG:Initializing WebSocket
06-08-2019 12:47:32 DEBUG:Validating WebSocket request
06-08-2019 12:47:32 INFO:127.0.0.1 - - [2019-08-06 12:47:32] "GET /css/main-uikit.css HTTP/1.1" 200 556 0.001995
06-08-2019 12:47:32 DEBUG:Initializing WebSocket
06-08-2019 12:47:32 DEBUG:Validating WebSocket request
06-08-2019 12:47:32 INFO:127.0.0.1 - - [2019-08-06 12:47:32] "GET /js/uikit-icons.min.js HTTP/1.1" 200 63621 0.000997
06-08-2019 12:47:32 DEBUG:Initializing WebSocket
06-08-2019 12:47:32 DEBUG:Validating WebSocket request
06-08-2019 12:47:32 INFO:127.0.0.1 - - [2019-08-06 12:47:32] "GET /js/jquery-3.3.1.min.js HTTP/1.1" 200 87114 0.000997
06-08-2019 12:47:32 DEBUG:Initializing WebSocket
06-08-2019 12:47:32 DEBUG:Validating WebSocket request
06-08-2019 12:47:32 INFO:127.0.0.1 - - [2019-08-06 12:47:32] "GET /js/uikit.min.js HTTP/1.1" 200 132179 0.001006
06-08-2019 12:47:32 DEBUG:Initializing WebSocket
06-08-2019 12:47:32 DEBUG:Validating WebSocket request
06-08-2019 12:47:32 INFO:127.0.0.1 - - [2019-08-06 12:47:32] "GET /js/leaflet.js HTTP/1.1" 200 141315 0.000997
06-08-2019 12:47:32 DEBUG:Initializing WebSocket
06-08-2019 12:47:32 DEBUG:Validating WebSocket request
06-08-2019 12:47:32 INFO:127.0.0.1 - - [2019-08-06 12:47:32] "GET /eel.js HTTP/1.1" 200 4803 0.000000
06-08-2019 12:47:32 DEBUG:Initializing WebSocket
06-08-2019 12:47:32 DEBUG:Validating WebSocket request
06-08-2019 12:47:32 INFO:127.0.0.1 - - [2019-08-06 12:47:32] "GET /js/script-uikit.js HTTP/1.1" 200 12495 0.000000
06-08-2019 12:47:32 DEBUG:Initializing WebSocket
06-08-2019 12:47:32 DEBUG:Validating WebSocket request
06-08-2019 12:47:32 INFO:127.0.0.1 - - [2019-08-06 12:47:32] "GET /favicon.ico HTTP/1.1" 200 15261 0.000997
06-08-2019 12:47:33 DEBUG:Initializing WebSocket
06-08-2019 12:47:33 DEBUG:Validating WebSocket request
06-08-2019 12:47:33 INFO:127.0.0.1 - - [2019-08-06 12:47:33] "GET /css/images/marker-icon.png HTTP/1.1" 200 1637 0.000997
06-08-2019 12:47:33 DEBUG:Initializing WebSocket
06-08-2019 12:47:33 DEBUG:Validating WebSocket request
06-08-2019 12:47:33 INFO:127.0.0.1 - - [2019-08-06 12:47:33] "GET /css/images/marker-shadow.png HTTP/1.1" 200 788 0.001994
06-08-2019 12:47:33 DEBUG:Initializing WebSocket
06-08-2019 12:47:33 DEBUG:Validating WebSocket request
06-08-2019 12:47:33 DEBUG:Attempting to upgrade connection
06-08-2019 12:47:33 DEBUG:WebSocket request accepted, switching protocols
06-08-2019 12:47:45 DEBUG:Введенный кад. номер: 6606450105920
06-08-2019 12:47:45 DEBUG:Starting new HTTP connection (1): pkk5.rosreestr.ru:80
06-08-2019 12:47:45 DEBUG:http://pkk5.rosreestr.ru:80 "POST /api/features/1/66:6:4501059:20 HTTP/1.1" 301 0
06-08-2019 12:47:45 DEBUG:Starting new HTTPS connection (1): pkk5.rosreestr.ru:443
06-08-2019 12:47:45 DEBUG:https://pkk5.rosreestr.ru:443 "GET /api/features/1/66:6:4501059:20 HTTP/1.1" 200 1961
06-08-2019 12:47:45 INFO:Кадастровый номер: 66:06:4501059:20
Адрес: обл. Свердловская, р-н Белоярский,  41 км К-Уральского тракта, СНТ "Елена" участок № 50
Координаты:
56,68013 	61,149196
56°40ʹ48ʺ с.ш. 61°08ʹ57ʺ в.д.
Лист М 1:200000 : O-41-26

https://yandex.ru/maps/?mode=search&text=56.68013%2C61.149196

file://d:/OziExplorer/data/CADASTER.txt
Datum,WGS 84
WP,D,66:06:4501059:20,56.68013 ,61.149196,08/06/19,12/47/45,,D,N,-9999

06-08-2019 12:49:33 DEBUG:Адрес:обл. Свердловская, р-н Белоярский,  41 км К-Уральского тракта, СНТ "Елена" участок № 50
06-08-2019 12:49:33 DEBUG:Папка с отчетом:Каменск-Уральский тракт 41 км СНТ Елена уч 50 Август 2019
06-08-2019 12:56:43 DEBUG:Closed WebSocket
06-08-2019 12:56:44 DEBUG:Failed to write closing frame -> closing socket
06-08-2019 12:56:44 DEBUG:Closed WebSocket
06-08-2019 12:58:47 INFO:******************** Starting Cadastron v2.142 Build: 02-08-2019-16:56:25 ********************
06-08-2019 12:58:47 DEBUG:Initializing WebSocket
06-08-2019 12:58:47 DEBUG:Validating WebSocket request
06-08-2019 12:58:47 INFO:127.0.0.1 - - [2019-08-06 12:58:47] "GET /eel.js HTTP/1.1" 200 4803 0.000000
06-08-2019 12:58:48 DEBUG:Initializing WebSocket
06-08-2019 12:58:48 DEBUG:Validating WebSocket request
06-08-2019 12:58:48 DEBUG:Attempting to upgrade connection
06-08-2019 12:58:48 DEBUG:WebSocket request accepted, switching protocols
06-08-2019 12:59:12 DEBUG:Введенный кад. номер: 664105070793
06-08-2019 12:59:12 DEBUG:Starting new HTTP connection (1): pkk5.rosreestr.ru:80
06-08-2019 12:59:12 DEBUG:http://pkk5.rosreestr.ru:80 "POST /api/features/1/66:41:507079:3 HTTP/1.1" 301 0
06-08-2019 12:59:12 DEBUG:Starting new HTTPS connection (1): pkk5.rosreestr.ru:443
06-08-2019 12:59:12 DEBUG:https://pkk5.rosreestr.ru:443 "GET /api/features/1/66:41:507079:3 HTTP/1.1" 200 39
06-08-2019 12:59:12 DEBUG:Данных об участке нет
06-08-2019 01:05:21 DEBUG:Введенный кад. номер: 6641050707934
06-08-2019 01:05:21 DEBUG:Starting new HTTP connection (1): pkk5.rosreestr.ru:80
06-08-2019 01:05:21 DEBUG:http://pkk5.rosreestr.ru:80 "POST /api/features/1/66:41:507079:34 HTTP/1.1" 301 0
06-08-2019 01:05:21 DEBUG:Starting new HTTPS connection (1): pkk5.rosreestr.ru:443
06-08-2019 01:05:22 DEBUG:https://pkk5.rosreestr.ru:443 "GET /api/features/1/66:41:507079:34 HTTP/1.1" 200 2302
06-08-2019 01:05:22 INFO:Кадастровый номер: 66:41:0507079:34
Адрес: Свердловская область, г. Екатеринбург
Координаты:
56,70551 	60,622624
56°42ʹ19ʺ с.ш. 60°37ʹ21ʺ в.д.
Лист М 1:200000 : O-41-25

https://yandex.ru/maps/?mode=search&text=56.70551%2C60.622624

file://d:/OziExplorer/data/CADASTER.txt
Datum,WGS 84
WP,D,66:41:0507079:34,56.70551 ,60.622624,08/06/19,13/05/22,,D,N,-9999

06-08-2019 01:09:23 DEBUG:Адрес:г. Екатеринбург, Елизаветинский опытный завод
06-08-2019 01:09:23 DEBUG:Папка с отчетом:Екатеринбург, Елизаветинский опытный завод Август 2019
06-08-2019 01:15:27 DEBUG:Closed WebSocket
06-08-2019 01:15:28 DEBUG:Failed to write closing frame -> closing socket
06-08-2019 01:15:28 DEBUG:Closed WebSocket
06-08-2019 04:51:59 INFO:******************** Starting Cadastron v2.142 Build: 02-08-2019-16:56:25 ********************
06-08-2019 04:51:59 DEBUG:Initializing WebSocket
06-08-2019 04:51:59 DEBUG:Validating WebSocket request
06-08-2019 04:51:59 INFO:127.0.0.1 - - [2019-08-06 16:51:59] "GET /eel.js HTTP/1.1" 200 4803 0.000000
06-08-2019 04:51:59 DEBUG:Initializing WebSocket
06-08-2019 04:51:59 DEBUG:Validating WebSocket request
06-08-2019 04:51:59 DEBUG:Attempting to upgrade connection
06-08-2019 04:51:59 DEBUG:WebSocket request accepted, switching protocols
06-08-2019 04:52:31 DEBUG:Введенный кад. номер: 664105150305
06-08-2019 04:52:31 DEBUG:Starting new HTTP connection (1): pkk5.rosreestr.ru:80
06-08-2019 04:52:31 DEBUG:http://pkk5.rosreestr.ru:80 "POST /api/features/1/66:41:515030:5 HTTP/1.1" 301 0
06-08-2019 04:52:31 DEBUG:Starting new HTTPS connection (1): pkk5.rosreestr.ru:443
06-08-2019 04:52:31 DEBUG:https://pkk5.rosreestr.ru:443 "GET /api/features/1/66:41:515030:5 HTTP/1.1" 200 1681
06-08-2019 04:52:31 INFO:Кадастровый номер: 66:41:0515030:5
Адрес: обл. Свердловская, г. Екатеринбург, п. Шабровский, ул. Серова, дом 30
Координаты:
56,636028	60,57617 
56°38ʹ09ʺ с.ш. 60°34ʹ34ʺ в.д.
Лист М 1:200000 : O-41-31

https://yandex.ru/maps/?mode=search&text=56.636028%2C60.57617

file://d:/OziExplorer/data/CADASTER.txt
Datum,WGS 84
WP,D,66:41:0515030:5,56.636028,60.57617 ,08/06/19,16/52/31,,D,N,-9999

06-08-2019 04:56:54 DEBUG:Closed WebSocket
06-08-2019 04:56:55 DEBUG:Failed to write closing frame -> closing socket
06-08-2019 04:56:55 DEBUG:Closed WebSocket
06-08-2019 04:57:24 INFO:******************** Starting Cadastron v2.142 Build: 02-08-2019-16:56:25 ********************
06-08-2019 04:57:24 DEBUG:Initializing WebSocket
06-08-2019 04:57:24 DEBUG:Validating WebSocket request
06-08-2019 04:57:25 INFO:127.0.0.1 - - [2019-08-06 16:57:25] "GET /eel.js HTTP/1.1" 200 4803 0.000997
06-08-2019 04:57:25 DEBUG:Initializing WebSocket
06-08-2019 04:57:25 DEBUG:Validating WebSocket request
06-08-2019 04:57:25 DEBUG:Attempting to upgrade connection
06-08-2019 04:57:25 DEBUG:WebSocket request accepted, switching protocols
12-08-2019 10:22:37 INFO:******************** Starting Cadastron v2.147 Build: 07-08-2019-08:59:17 ********************
12-08-2019 10:22:38 DEBUG:Initializing WebSocket
12-08-2019 10:22:38 DEBUG:Validating WebSocket request
12-08-2019 10:22:38 INFO:127.0.0.1 - - [2019-08-12 10:22:38] "GET /main-uikit.html HTTP/1.1" 200 9516 0.304487
12-08-2019 10:22:38 DEBUG:Initializing WebSocket
12-08-2019 10:22:38 DEBUG:Validating WebSocket request
12-08-2019 10:22:38 INFO:127.0.0.1 - - [2019-08-12 10:22:38] "GET /css/uikit.min.css HTTP/1.1" 200 253541 0.028922
12-08-2019 10:22:38 DEBUG:Initializing WebSocket
12-08-2019 10:22:38 DEBUG:Validating WebSocket request
12-08-2019 10:22:38 INFO:127.0.0.1 - - [2019-08-12 10:22:38] "GET /css/leaflet.css HTTP/1.1" 200 14292 0.029919
12-08-2019 10:22:38 DEBUG:Initializing WebSocket
12-08-2019 10:22:38 DEBUG:Validating WebSocket request
12-08-2019 10:22:38 INFO:127.0.0.1 - - [2019-08-12 10:22:38] "GET /css/main-uikit.css HTTP/1.1" 200 556 0.000998
12-08-2019 10:22:38 DEBUG:Initializing WebSocket
12-08-2019 10:22:38 DEBUG:Validating WebSocket request
12-08-2019 10:22:38 INFO:127.0.0.1 - - [2019-08-12 10:22:38] "GET /js/uikit-icons.min.js HTTP/1.1" 200 63621 0.000998
12-08-2019 10:22:38 DEBUG:Initializing WebSocket
12-08-2019 10:22:38 DEBUG:Validating WebSocket request
12-08-2019 10:22:38 INFO:127.0.0.1 - - [2019-08-12 10:22:38] "GET /js/jquery-3.3.1.min.js HTTP/1.1" 200 87114 0.000997
12-08-2019 10:22:38 DEBUG:Initializing WebSocket
12-08-2019 10:22:38 DEBUG:Validating WebSocket request
12-08-2019 10:22:38 INFO:127.0.0.1 - - [2019-08-12 10:22:38] "GET /js/uikit.min.js HTTP/1.1" 200 132179 0.000998
12-08-2019 10:22:38 DEBUG:Initializing WebSocket
12-08-2019 10:22:38 DEBUG:Validating WebSocket request
12-08-2019 10:22:38 INFO:127.0.0.1 - - [2019-08-12 10:22:38] "GET /js/leaflet.js HTTP/1.1" 200 141315 0.000997
12-08-2019 10:22:38 DEBUG:Initializing WebSocket
12-08-2019 10:22:38 DEBUG:Validating WebSocket request
12-08-2019 10:22:38 INFO:127.0.0.1 - - [2019-08-12 10:22:38] "GET /eel.js HTTP/1.1" 200 4803 0.000997
12-08-2019 10:22:38 DEBUG:Initializing WebSocket
12-08-2019 10:22:38 DEBUG:Validating WebSocket request
12-08-2019 10:22:38 INFO:127.0.0.1 - - [2019-08-12 10:22:38] "GET /js/script-uikit.js HTTP/1.1" 200 12495 0.000998
12-08-2019 10:22:38 DEBUG:Initializing WebSocket
12-08-2019 10:22:38 DEBUG:Validating WebSocket request
12-08-2019 10:22:38 INFO:127.0.0.1 - - [2019-08-12 10:22:38] "GET /favicon.ico HTTP/1.1" 200 15261 0.007978
12-08-2019 10:22:39 DEBUG:Initializing WebSocket
12-08-2019 10:22:39 DEBUG:Validating WebSocket request
12-08-2019 10:22:39 INFO:127.0.0.1 - - [2019-08-12 10:22:39] "GET /css/images/marker-icon.png HTTP/1.1" 200 1637 0.014960
12-08-2019 10:22:39 DEBUG:Initializing WebSocket
12-08-2019 10:22:39 DEBUG:Validating WebSocket request
12-08-2019 10:22:39 INFO:127.0.0.1 - - [2019-08-12 10:22:39] "GET /css/images/marker-shadow.png HTTP/1.1" 200 788 0.001995
12-08-2019 10:22:39 DEBUG:Initializing WebSocket
12-08-2019 10:22:39 DEBUG:Validating WebSocket request
12-08-2019 10:22:39 DEBUG:Attempting to upgrade connection
12-08-2019 10:22:39 DEBUG:WebSocket request accepted, switching protocols
12-08-2019 10:22:44 DEBUG:Введенный кад. номер: 74:09:0607001:690
12-08-2019 10:22:44 DEBUG:Starting new HTTP connection (1): pkk5.rosreestr.ru:80
12-08-2019 10:22:44 DEBUG:http://pkk5.rosreestr.ru:80 "POST /api/features/1/74:9:607001:690 HTTP/1.1" 301 0
12-08-2019 10:22:44 DEBUG:Starting new HTTPS connection (1): pkk5.rosreestr.ru:443
12-08-2019 10:22:44 DEBUG:https://pkk5.rosreestr.ru:443 "GET /api/features/1/74:9:607001:690 HTTP/1.1" 200 2177
12-08-2019 10:22:44 INFO:Кадастровый номер: 74:09:0607001:690
Адрес: Челябинская область, р-н Каслинский, д Григорьевка, ул Березовая, д 12
Координаты:
56,161605	60,916659
56°09ʹ41ʺ с.ш. 60°54ʹ59ʺ в.д.
Лист М 1:200000 : O-41-31

https://yandex.ru/maps/?mode=search&text=56.161605%2C60.916659

file://d:/OziExplorer/data/CADASTER.txt
Datum,WGS 84
WP,D,74:09:0607001:690,56.161605,60.916659,08/12/19,10/22/44,,D,N,-9999

12-08-2019 10:22:59 DEBUG:Адрес:Челябинская область, р-н Каслинский, д Григорьевка, ул Березовая, д 12
12-08-2019 10:22:59 DEBUG:Папка с паспортом:Паспорт Григорьевка, ул Березовая, д 12
12-08-2019 10:22:59 DEBUG:Путь к папке с отчетом:D:\Home System\ИЗЫСКАНИЯ\Паспорта скважин\2019\Паспорт Григорьевка, ул Березовая, д 12
12-08-2019 10:25:27 DEBUG:Closed WebSocket
12-08-2019 10:25:28 DEBUG:Failed to write closing frame -> closing socket
12-08-2019 10:25:28 DEBUG:Closed WebSocket
12-08-2019 04:00:42 INFO:******************** Starting Cadastron v2.147 Build: 07-08-2019-08:59:17 ********************
12-08-2019 04:00:43 DEBUG:Initializing WebSocket
12-08-2019 04:00:43 DEBUG:Validating WebSocket request
12-08-2019 04:00:43 INFO:127.0.0.1 - - [2019-08-12 16:00:43] "GET /main-uikit.html HTTP/1.1" 200 9516 0.294212
12-08-2019 04:00:43 DEBUG:Initializing WebSocket
12-08-2019 04:00:43 DEBUG:Validating WebSocket request
12-08-2019 04:00:43 INFO:127.0.0.1 - - [2019-08-12 16:00:43] "GET /css/uikit.min.css HTTP/1.1" 200 253541 0.000997
12-08-2019 04:00:43 DEBUG:Initializing WebSocket
12-08-2019 04:00:43 DEBUG:Validating WebSocket request
12-08-2019 04:00:43 INFO:127.0.0.1 - - [2019-08-12 16:00:43] "GET /css/leaflet.css HTTP/1.1" 200 14292 0.000998
12-08-2019 04:00:43 DEBUG:Initializing WebSocket
12-08-2019 04:00:43 DEBUG:Validating WebSocket request
12-08-2019 04:00:43 INFO:127.0.0.1 - - [2019-08-12 16:00:43] "GET /css/main-uikit.css HTTP/1.1" 200 556 0.000997
12-08-2019 04:00:43 DEBUG:Initializing WebSocket
12-08-2019 04:00:43 DEBUG:Validating WebSocket request
12-08-2019 04:00:43 INFO:127.0.0.1 - - [2019-08-12 16:00:43] "GET /js/uikit.min.js HTTP/1.1" 200 132179 0.000997
12-08-2019 04:00:43 DEBUG:Initializing WebSocket
12-08-2019 04:00:43 DEBUG:Validating WebSocket request
12-08-2019 04:00:43 INFO:127.0.0.1 - - [2019-08-12 16:00:43] "GET /js/uikit-icons.min.js HTTP/1.1" 200 63621 0.000998
12-08-2019 04:00:43 DEBUG:Initializing WebSocket
12-08-2019 04:00:43 DEBUG:Validating WebSocket request
12-08-2019 04:00:43 INFO:127.0.0.1 - - [2019-08-12 16:00:43] "GET /js/jquery-3.3.1.min.js HTTP/1.1" 200 87114 0.000998
12-08-2019 04:00:43 DEBUG:Initializing WebSocket
12-08-2019 04:00:43 DEBUG:Validating WebSocket request
12-08-2019 04:00:43 INFO:127.0.0.1 - - [2019-08-12 16:00:43] "GET /js/leaflet.js HTTP/1.1" 200 141315 0.000997
12-08-2019 04:00:43 DEBUG:Initializing WebSocket
12-08-2019 04:00:43 DEBUG:Validating WebSocket request
12-08-2019 04:00:43 INFO:127.0.0.1 - - [2019-08-12 16:00:43] "GET /eel.js HTTP/1.1" 200 4803 0.000000
12-08-2019 04:00:43 DEBUG:Initializing WebSocket
12-08-2019 04:00:43 DEBUG:Validating WebSocket request
12-08-2019 04:00:43 INFO:127.0.0.1 - - [2019-08-12 16:00:43] "GET /js/script-uikit.js HTTP/1.1" 200 12495 0.000999
12-08-2019 04:00:43 DEBUG:Initializing WebSocket
12-08-2019 04:00:43 DEBUG:Validating WebSocket request
12-08-2019 04:00:43 INFO:127.0.0.1 - - [2019-08-12 16:00:43] "GET /favicon.ico HTTP/1.1" 200 15261 0.000996
12-08-2019 04:00:44 DEBUG:Initializing WebSocket
12-08-2019 04:00:44 DEBUG:Validating WebSocket request
12-08-2019 04:00:44 INFO:127.0.0.1 - - [2019-08-12 16:00:44] "GET /css/images/marker-icon.png HTTP/1.1" 200 1637 0.000998
12-08-2019 04:00:44 DEBUG:Initializing WebSocket
12-08-2019 04:00:44 DEBUG:Validating WebSocket request
12-08-2019 04:00:44 INFO:127.0.0.1 - - [2019-08-12 16:00:44] "GET /css/images/marker-shadow.png HTTP/1.1" 200 788 0.000998
12-08-2019 04:00:44 DEBUG:Initializing WebSocket
12-08-2019 04:00:44 DEBUG:Validating WebSocket request
12-08-2019 04:00:44 DEBUG:Attempting to upgrade connection
12-08-2019 04:00:44 DEBUG:WebSocket request accepted, switching protocols
12-08-2019 04:01:33 DEBUG:Введенный кад. номер: 6658060100151
12-08-2019 04:01:33 DEBUG:Starting new HTTP connection (1): pkk5.rosreestr.ru:80
12-08-2019 04:01:33 DEBUG:http://pkk5.rosreestr.ru:80 "POST /api/features/1/66:58:601001:51 HTTP/1.1" 301 0
12-08-2019 04:01:33 DEBUG:Starting new HTTPS connection (1): pkk5.rosreestr.ru:443
12-08-2019 04:01:33 DEBUG:https://pkk5.rosreestr.ru:443 "GET /api/features/1/66:58:601001:51 HTTP/1.1" 200 2099
12-08-2019 04:01:33 INFO:Кадастровый номер: 66:58:0601001:51
Адрес: Свердловская обл, г Первоуральск, д Каменка, ул Верхняя, д 12
Координаты:
57,061044	59,506271
57°03ʹ39ʺ с.ш. 59°30ʹ22ʺ в.д.
Лист М 1:200000 : O-40-30

https://yandex.ru/maps/?mode=search&text=57.061044%2C59.506271

file://d:/OziExplorer/data/CADASTER.txt
Datum,WGS 84
WP,D,66:58:0601001:51,57.061044,59.506271,08/12/19,16/01/33,,D,N,-9999

12-08-2019 04:03:41 DEBUG:Адрес:Свердловская обл., г.Первоуральск, д.Каменка, ул. Верхняя, д. 12
12-08-2019 04:03:41 DEBUG:Папка с отчетом:Первоуральск Каменка, ул Верхняя, 12 Август 2019
12-08-2019 04:08:52 DEBUG:Closed WebSocket
12-08-2019 04:08:53 DEBUG:Failed to write closing frame -> closing socket
12-08-2019 04:08:53 DEBUG:Closed WebSocket
14-08-2019 04:28:05 INFO:******************** Starting Cadastron v2.147 Build: 07-08-2019-08:59:17 ********************
14-08-2019 04:28:05 DEBUG:Initializing WebSocket
14-08-2019 04:28:05 DEBUG:Validating WebSocket request
14-08-2019 04:28:05 INFO:127.0.0.1 - - [2019-08-14 16:28:05] "GET /main-uikit.html HTTP/1.1" 200 9516 0.310173
14-08-2019 04:28:05 DEBUG:Initializing WebSocket
14-08-2019 04:28:05 DEBUG:Validating WebSocket request
14-08-2019 04:28:05 INFO:127.0.0.1 - - [2019-08-14 16:28:05] "GET /css/uikit.min.css HTTP/1.1" 200 253541 0.016954
14-08-2019 04:28:05 DEBUG:Initializing WebSocket
14-08-2019 04:28:05 DEBUG:Validating WebSocket request
14-08-2019 04:28:05 INFO:127.0.0.1 - - [2019-08-14 16:28:05] "GET /js/uikit.min.js HTTP/1.1" 200 132179 0.000997
14-08-2019 04:28:05 DEBUG:Initializing WebSocket
14-08-2019 04:28:05 DEBUG:Validating WebSocket request
14-08-2019 04:28:05 INFO:127.0.0.1 - - [2019-08-14 16:28:05] "GET /css/leaflet.css HTTP/1.1" 200 14292 0.018949
14-08-2019 04:28:05 DEBUG:Initializing WebSocket
14-08-2019 04:28:05 DEBUG:Validating WebSocket request
14-08-2019 04:28:05 INFO:127.0.0.1 - - [2019-08-14 16:28:05] "GET /css/main-uikit.css HTTP/1.1" 200 556 0.000997
14-08-2019 04:28:05 DEBUG:Initializing WebSocket
14-08-2019 04:28:05 DEBUG:Validating WebSocket request
14-08-2019 04:28:05 INFO:127.0.0.1 - - [2019-08-14 16:28:05] "GET /js/uikit-icons.min.js HTTP/1.1" 200 63621 0.000000
14-08-2019 04:28:05 DEBUG:Initializing WebSocket
14-08-2019 04:28:05 DEBUG:Validating WebSocket request
14-08-2019 04:28:05 INFO:127.0.0.1 - - [2019-08-14 16:28:05] "GET /js/jquery-3.3.1.min.js HTTP/1.1" 200 87114 0.000997
14-08-2019 04:28:05 DEBUG:Initializing WebSocket
14-08-2019 04:28:05 DEBUG:Validating WebSocket request
14-08-2019 04:28:05 INFO:127.0.0.1 - - [2019-08-14 16:28:05] "GET /js/leaflet.js HTTP/1.1" 200 141315 0.000997
14-08-2019 04:28:05 DEBUG:Initializing WebSocket
14-08-2019 04:28:05 DEBUG:Validating WebSocket request
14-08-2019 04:28:05 INFO:127.0.0.1 - - [2019-08-14 16:28:05] "GET /eel.js HTTP/1.1" 200 4803 0.000997
14-08-2019 04:28:05 DEBUG:Initializing WebSocket
14-08-2019 04:28:05 DEBUG:Validating WebSocket request
14-08-2019 04:28:05 INFO:127.0.0.1 - - [2019-08-14 16:28:05] "GET /js/script-uikit.js HTTP/1.1" 200 12495 0.000997
14-08-2019 04:28:05 DEBUG:Initializing WebSocket
14-08-2019 04:28:05 DEBUG:Validating WebSocket request
14-08-2019 04:28:05 INFO:127.0.0.1 - - [2019-08-14 16:28:05] "GET /favicon.ico HTTP/1.1" 200 15261 0.007978
14-08-2019 04:28:06 DEBUG:Initializing WebSocket
14-08-2019 04:28:06 DEBUG:Validating WebSocket request
14-08-2019 04:28:06 INFO:127.0.0.1 - - [2019-08-14 16:28:06] "GET /css/images/marker-icon.png HTTP/1.1" 200 1637 0.012965
14-08-2019 04:28:06 DEBUG:Initializing WebSocket
14-08-2019 04:28:06 DEBUG:Validating WebSocket request
14-08-2019 04:28:06 INFO:127.0.0.1 - - [2019-08-14 16:28:06] "GET /css/images/marker-shadow.png HTTP/1.1" 200 788 0.000997
14-08-2019 04:28:06 DEBUG:Initializing WebSocket
14-08-2019 04:28:06 DEBUG:Validating WebSocket request
14-08-2019 04:28:06 DEBUG:Attempting to upgrade connection
14-08-2019 04:28:06 DEBUG:WebSocket request accepted, switching protocols
14-08-2019 04:28:24 DEBUG:Введенный кад. номер: 6625400100159
14-08-2019 04:28:24 DEBUG:Starting new HTTP connection (1): pkk5.rosreestr.ru:80
14-08-2019 04:28:24 DEBUG:http://pkk5.rosreestr.ru:80 "POST /api/features/1/66:25:4001001:59 HTTP/1.1" 301 0
14-08-2019 04:28:24 DEBUG:Starting new HTTPS connection (1): pkk5.rosreestr.ru:443
14-08-2019 04:28:24 DEBUG:https://pkk5.rosreestr.ru:443 "GET /api/features/1/66:25:4001001:59 HTTP/1.1" 200 1876
14-08-2019 04:28:24 INFO:Кадастровый номер: 66:25:4001001:59
Адрес: обл. Свердловская, р-н Сысертский, д. Космакова, ул. Мира, дом 18
Координаты:
56,353364	60,841379
56°21ʹ12ʺ с.ш. 60°50ʹ28ʺ в.д.
Лист М 1:200000 : O-41-31

https://yandex.ru/maps/?mode=search&text=56.353364%2C60.841379

file://d:/OziExplorer/data/CADASTER.txt
Datum,WGS 84
WP,D,66:25:4001001:59,56.353364,60.841379,08/14/19,16/28/24,,D,N,-9999

14-08-2019 04:29:07 DEBUG:Адрес:обл. Свердловская, р-н Сысертский, д. Космакова, ул. Мира, дом 18
14-08-2019 04:29:07 DEBUG:Папка с отчетом:Космаково ул. Мира 18 Август 2019
14-08-2019 04:38:57 DEBUG:Closed WebSocket
14-08-2019 04:38:58 DEBUG:Failed to write closing frame -> closing socket
14-08-2019 04:38:58 DEBUG:Closed WebSocket
14-08-2019 04:38:59 INFO:******************** Starting Cadastron v2.147 Build: 07-08-2019-08:59:17 ********************
14-08-2019 04:39:00 DEBUG:Initializing WebSocket
14-08-2019 04:39:00 DEBUG:Validating WebSocket request
14-08-2019 04:39:00 INFO:127.0.0.1 - - [2019-08-14 16:39:00] "GET /eel.js HTTP/1.1" 200 4803 0.000000
14-08-2019 04:39:00 DEBUG:Initializing WebSocket
14-08-2019 04:39:00 DEBUG:Validating WebSocket request
14-08-2019 04:39:00 DEBUG:Attempting to upgrade connection
14-08-2019 04:39:00 DEBUG:WebSocket request accepted, switching protocols
14-08-2019 04:39:13 DEBUG:Введенный кад. номер: 66070701001437
14-08-2019 04:39:13 DEBUG:Starting new HTTP connection (1): pkk5.rosreestr.ru:80
14-08-2019 04:39:13 DEBUG:http://pkk5.rosreestr.ru:80 "POST /api/features/1/66:7:701001:437 HTTP/1.1" 301 0
14-08-2019 04:39:13 DEBUG:Starting new HTTPS connection (1): pkk5.rosreestr.ru:443
14-08-2019 04:39:13 DEBUG:https://pkk5.rosreestr.ru:443 "GET /api/features/1/66:7:701001:437 HTTP/1.1" 200 3313
14-08-2019 04:39:13 INFO:Кадастровый номер: 66:07:0701001:437
Адрес: Свердловская обл, р-н Богдановичский, примерно в 250 метрах по направлению на восток от дома № 15 по улице Азина деревни Билейка Богдановичского района Свердловской области
Координаты:
56,774348	61,849279
56°46ʹ27ʺ с.ш. 61°50ʹ57ʺ в.д.
Лист М 1:200000 : O-41-26

https://yandex.ru/maps/?mode=search&text=56.774348%2C61.849279

file://d:/OziExplorer/data/CADASTER.txt
Datum,WGS 84
WP,D,66:07:0701001:437,56.774348,61.849279,08/14/19,16/39/13,,D,N,-9999

14-08-2019 04:41:54 DEBUG:Адрес:Свердловская обл. Богдановичский р-н, д.Билейка в 250 м. от дома № 15 по ул. Азина
14-08-2019 04:41:54 DEBUG:Папка с отчетом:Богдановичский р-н Билейка Август 2019
14-08-2019 04:53:13 DEBUG:Closed WebSocket
14-08-2019 04:53:14 DEBUG:Failed to write closing frame -> closing socket
14-08-2019 04:53:14 DEBUG:Closed WebSocket
15-08-2019 09:56:01 INFO:******************** Starting Cadastron v2.147 Build: 07-08-2019-08:59:17 ********************
15-08-2019 09:56:02 DEBUG:Initializing WebSocket
15-08-2019 09:56:02 DEBUG:Validating WebSocket request
15-08-2019 09:56:02 INFO:127.0.0.1 - - [2019-08-15 09:56:02] "GET /eel.js HTTP/1.1" 200 4803 0.000000
15-08-2019 09:56:02 DEBUG:Initializing WebSocket
15-08-2019 09:56:02 DEBUG:Validating WebSocket request
15-08-2019 09:56:02 DEBUG:Attempting to upgrade connection
15-08-2019 09:56:02 DEBUG:WebSocket request accepted, switching protocols
15-08-2019 09:56:17 DEBUG:Введенный кад. номер: 6641031009731
15-08-2019 09:56:17 DEBUG:Starting new HTTP connection (1): pkk5.rosreestr.ru:80
15-08-2019 09:56:17 DEBUG:http://pkk5.rosreestr.ru:80 "POST /api/features/1/66:41:310097:31 HTTP/1.1" 301 0
15-08-2019 09:56:17 DEBUG:Starting new HTTPS connection (1): pkk5.rosreestr.ru:443
15-08-2019 09:56:17 DEBUG:https://pkk5.rosreestr.ru:443 "GET /api/features/1/66:41:310097:31 HTTP/1.1" 200 2158
15-08-2019 09:56:17 INFO:Кадастровый номер: 66:41:0310097:31
Адрес: обл. Свердловская, г. Екатеринбург,  коллективный сад фабрики "Спортодежда",  уч. 31
Координаты:
56,766355	60,352456
56°45ʹ58ʺ с.ш. 60°21ʹ08ʺ в.д.
Лист М 1:200000 : O-41-25

https://yandex.ru/maps/?mode=search&text=56.766355%2C60.352456

file://d:/OziExplorer/data/CADASTER.txt
Datum,WGS 84
WP,D,66:41:0310097:31,56.766355,60.352456,08/15/19,09/56/17,,D,N,-9999

15-08-2019 09:57:12 DEBUG:Адрес:обл. Свердловская, г. Екатеринбург,  коллективный сад фабрики "Спортодежда",  уч. 31
15-08-2019 09:57:12 DEBUG:Папка с отчетом:СНТ Спортодежда,  уч. 31 Август 2019
15-08-2019 10:02:39 DEBUG:Closed WebSocket
15-08-2019 10:02:40 DEBUG:Failed to write closing frame -> closing socket
15-08-2019 10:02:40 DEBUG:Closed WebSocket
15-08-2019 10:03:38 INFO:******************** Starting Cadastron v2.147 Build: 07-08-2019-08:59:17 ********************
15-08-2019 10:03:39 DEBUG:Initializing WebSocket
15-08-2019 10:03:39 DEBUG:Validating WebSocket request
15-08-2019 10:03:39 INFO:127.0.0.1 - - [2019-08-15 10:03:39] "GET /eel.js HTTP/1.1" 200 4803 0.000998
15-08-2019 10:03:39 DEBUG:Initializing WebSocket
15-08-2019 10:03:39 DEBUG:Validating WebSocket request
15-08-2019 10:03:39 DEBUG:Attempting to upgrade connection
15-08-2019 10:03:39 DEBUG:WebSocket request accepted, switching protocols
15-08-2019 10:03:54 DEBUG:Введенный кад. номер: 66:41:0310097:30
15-08-2019 10:03:54 DEBUG:Starting new HTTP connection (1): pkk5.rosreestr.ru:80
15-08-2019 10:03:54 DEBUG:http://pkk5.rosreestr.ru:80 "POST /api/features/1/66:41:310097:30 HTTP/1.1" 301 0
15-08-2019 10:03:54 DEBUG:Starting new HTTPS connection (1): pkk5.rosreestr.ru:443
15-08-2019 10:03:54 DEBUG:https://pkk5.rosreestr.ru:443 "GET /api/features/1/66:41:310097:30 HTTP/1.1" 200 2047
15-08-2019 10:03:54 INFO:Кадастровый номер: 66:41:0310097:30
Адрес: обл. Свердловская, г. Екатеринбург,  коллективный сад ф-ки "Спортодежда", уч. № 30
Координаты:
56,766423	60,352855
56°45ʹ59ʺ с.ш. 60°21ʹ10ʺ в.д.
Лист М 1:200000 : O-41-25

https://yandex.ru/maps/?mode=search&text=56.766423%2C60.352855

file://d:/OziExplorer/data/CADASTER.txt
Datum,WGS 84
WP,D,66:41:0310097:30,56.766423,60.352855,08/15/19,10/03/54,,D,N,-9999

15-08-2019 10:04:38 DEBUG:Адрес:Свердловская обл., г.Екатеринбург, КС фабрики <<Спортодежда>>, уч. 30
15-08-2019 10:04:38 DEBUG:Папка с отчетом:СНТ Спортодежда,  уч. 30 Август 2019
15-08-2019 10:06:09 DEBUG:Closed WebSocket
15-08-2019 10:06:10 DEBUG:Failed to write closing frame -> closing socket
15-08-2019 10:06:10 DEBUG:Closed WebSocket
15-08-2019 10:08:45 INFO:******************** Starting Cadastron v2.147 Build: 07-08-2019-08:59:17 ********************
15-08-2019 10:08:45 DEBUG:Initializing WebSocket
15-08-2019 10:08:45 DEBUG:Validating WebSocket request
15-08-2019 10:08:45 INFO:127.0.0.1 - - [2019-08-15 10:08:45] "GET /eel.js HTTP/1.1" 200 4803 0.000000
15-08-2019 10:08:46 DEBUG:Initializing WebSocket
15-08-2019 10:08:46 DEBUG:Validating WebSocket request
15-08-2019 10:08:46 DEBUG:Attempting to upgrade connection
15-08-2019 10:08:46 DEBUG:WebSocket request accepted, switching protocols
15-08-2019 10:08:57 DEBUG:Введенный кад. номер: 66350224002215
15-08-2019 10:08:57 DEBUG:Starting new HTTP connection (1): pkk5.rosreestr.ru:80
15-08-2019 10:08:57 DEBUG:http://pkk5.rosreestr.ru:80 "POST /api/features/1/66:35:224002:215 HTTP/1.1" 301 0
15-08-2019 10:08:57 DEBUG:Starting new HTTPS connection (1): pkk5.rosreestr.ru:443
15-08-2019 10:08:57 DEBUG:https://pkk5.rosreestr.ru:443 "GET /api/features/1/66:35:224002:215 HTTP/1.1" 200 2136
15-08-2019 10:08:57 INFO:Кадастровый номер: 66:35:0224002:215
Адрес: обл. Свердловская, г. Березовский, п. Сарапулка, ул. Калинина, дом 140
Координаты:
56,877287	61,054597
56°52ʹ38ʺ с.ш. 61°03ʹ16ʺ в.д.
Лист М 1:200000 : O-41-26

https://yandex.ru/maps/?mode=search&text=56.877287%2C61.054597

file://d:/OziExplorer/data/CADASTER.txt
Datum,WGS 84
WP,D,66:35:0224002:215,56.877287,61.054597,08/15/19,10/08/57,,D,N,-9999

15-08-2019 10:24:27 DEBUG:Closed WebSocket
15-08-2019 10:24:28 DEBUG:Failed to write closing frame -> closing socket
15-08-2019 10:24:28 DEBUG:Closed WebSocket
16-08-2019 12:05:21 INFO:******************** Starting Cadastron v2.147 Build: 07-08-2019-08:59:17 ********************
16-08-2019 12:05:22 DEBUG:Initializing WebSocket
16-08-2019 12:05:22 DEBUG:Validating WebSocket request
16-08-2019 12:05:22 INFO:127.0.0.1 - - [2019-08-16 12:05:22] "GET /main-uikit.html HTTP/1.1" 200 9516 0.333114
16-08-2019 12:05:22 DEBUG:Initializing WebSocket
16-08-2019 12:05:22 DEBUG:Validating WebSocket request
16-08-2019 12:05:22 INFO:127.0.0.1 - - [2019-08-16 12:05:22] "GET /css/uikit.min.css HTTP/1.1" 200 253541 0.017951
16-08-2019 12:05:22 DEBUG:Initializing WebSocket
16-08-2019 12:05:22 DEBUG:Validating WebSocket request
16-08-2019 12:05:22 INFO:127.0.0.1 - - [2019-08-16 12:05:22] "GET /css/leaflet.css HTTP/1.1" 200 14292 0.020945
16-08-2019 12:05:22 DEBUG:Initializing WebSocket
16-08-2019 12:05:22 DEBUG:Validating WebSocket request
16-08-2019 12:05:22 INFO:127.0.0.1 - - [2019-08-16 12:05:22] "GET /css/main-uikit.css HTTP/1.1" 200 556 0.000998
16-08-2019 12:05:22 DEBUG:Initializing WebSocket
16-08-2019 12:05:22 DEBUG:Validating WebSocket request
16-08-2019 12:05:22 INFO:127.0.0.1 - - [2019-08-16 12:05:22] "GET /js/uikit-icons.min.js HTTP/1.1" 200 63621 0.000985
16-08-2019 12:05:22 DEBUG:Initializing WebSocket
16-08-2019 12:05:22 DEBUG:Validating WebSocket request
16-08-2019 12:05:22 INFO:127.0.0.1 - - [2019-08-16 12:05:22] "GET /js/jquery-3.3.1.min.js HTTP/1.1" 200 87114 0.000998
16-08-2019 12:05:22 DEBUG:Initializing WebSocket
16-08-2019 12:05:22 DEBUG:Validating WebSocket request
16-08-2019 12:05:22 INFO:127.0.0.1 - - [2019-08-16 12:05:22] "GET /js/uikit.min.js HTTP/1.1" 200 132179 0.000999
16-08-2019 12:05:22 DEBUG:Initializing WebSocket
16-08-2019 12:05:22 DEBUG:Validating WebSocket request
16-08-2019 12:05:22 INFO:127.0.0.1 - - [2019-08-16 12:05:22] "GET /js/leaflet.js HTTP/1.1" 200 141315 0.000997
16-08-2019 12:05:22 DEBUG:Initializing WebSocket
16-08-2019 12:05:22 DEBUG:Validating WebSocket request
16-08-2019 12:05:22 INFO:127.0.0.1 - - [2019-08-16 12:05:22] "GET /eel.js HTTP/1.1" 200 4803 0.000996
16-08-2019 12:05:22 DEBUG:Initializing WebSocket
16-08-2019 12:05:22 DEBUG:Validating WebSocket request
16-08-2019 12:05:22 INFO:127.0.0.1 - - [2019-08-16 12:05:22] "GET /js/script-uikit.js HTTP/1.1" 200 12495 0.000998
16-08-2019 12:05:22 DEBUG:Initializing WebSocket
16-08-2019 12:05:22 DEBUG:Validating WebSocket request
16-08-2019 12:05:22 INFO:127.0.0.1 - - [2019-08-16 12:05:22] "GET /favicon.ico HTTP/1.1" 200 15261 0.018947
16-08-2019 12:05:23 DEBUG:Initializing WebSocket
16-08-2019 12:05:23 DEBUG:Validating WebSocket request
16-08-2019 12:05:23 INFO:127.0.0.1 - - [2019-08-16 12:05:23] "GET /css/images/marker-icon.png HTTP/1.1" 200 1637 0.018948
16-08-2019 12:05:23 DEBUG:Initializing WebSocket
16-08-2019 12:05:23 DEBUG:Validating WebSocket request
16-08-2019 12:05:23 INFO:127.0.0.1 - - [2019-08-16 12:05:23] "GET /css/images/marker-shadow.png HTTP/1.1" 200 788 0.002992
16-08-2019 12:05:23 DEBUG:Initializing WebSocket
16-08-2019 12:05:23 DEBUG:Validating WebSocket request
16-08-2019 12:05:23 DEBUG:Attempting to upgrade connection
16-08-2019 12:05:23 DEBUG:WebSocket request accepted, switching protocols
16-08-2019 12:05:34 DEBUG:Введенный кад. номер: 66252501001947
16-08-2019 12:05:34 DEBUG:Starting new HTTP connection (1): pkk5.rosreestr.ru:80
16-08-2019 12:05:34 DEBUG:http://pkk5.rosreestr.ru:80 "POST /api/features/1/66:25:2501001:947 HTTP/1.1" 301 0
16-08-2019 12:05:34 DEBUG:Starting new HTTPS connection (1): pkk5.rosreestr.ru:443
16-08-2019 12:05:34 DEBUG:https://pkk5.rosreestr.ru:443 "GET /api/features/1/66:25:2501001:947 HTTP/1.1" 200 2315
16-08-2019 12:05:34 INFO:Кадастровый номер: 66:25:2501001:947
Адрес: Свердловская область, Сысертский район, село Кадниково, улица Октябрьская, 12
Координаты:
56,588794	60,898703
56°35ʹ19ʺ с.ш. 60°53ʹ55ʺ в.д.
Лист М 1:200000 : O-41-31

https://yandex.ru/maps/?mode=search&text=56.588794%2C60.898703

file://d:/OziExplorer/data/CADASTER.txt
Datum,WGS 84
WP,D,66:25:2501001:947,56.588794,60.898703,08/16/19,12/05/34,,D,N,-9999

16-08-2019 12:06:37 DEBUG:Адрес:Свердловская обл., Сысертский р-н, с. Кадниково, ул. Октябрьская, 12
16-08-2019 12:06:37 DEBUG:Папка с отчетом:Кадниково, ул Октябрьская, 12 Август 2019
16-08-2019 12:09:53 DEBUG:Closed WebSocket
16-08-2019 12:09:54 DEBUG:Failed to write closing frame -> closing socket
16-08-2019 12:09:54 DEBUG:Closed WebSocket
16-08-2019 12:12:41 INFO:******************** Starting Cadastron v2.147 Build: 07-08-2019-08:59:17 ********************
16-08-2019 12:12:41 DEBUG:Initializing WebSocket
16-08-2019 12:12:41 DEBUG:Validating WebSocket request
16-08-2019 12:12:41 INFO:127.0.0.1 - - [2019-08-16 12:12:41] "GET /eel.js HTTP/1.1" 200 4803 0.000997
16-08-2019 12:12:42 DEBUG:Initializing WebSocket
16-08-2019 12:12:42 DEBUG:Validating WebSocket request
16-08-2019 12:12:42 DEBUG:Attempting to upgrade connection
16-08-2019 12:12:42 DEBUG:WebSocket request accepted, switching protocols
16-08-2019 12:12:45 DEBUG:Введенный кад. номер: 66:41:0514042:55
16-08-2019 12:12:45 DEBUG:Starting new HTTP connection (1): pkk5.rosreestr.ru:80
16-08-2019 12:12:46 DEBUG:http://pkk5.rosreestr.ru:80 "POST /api/features/1/66:41:514042:55 HTTP/1.1" 301 0
16-08-2019 12:12:46 DEBUG:Starting new HTTPS connection (1): pkk5.rosreestr.ru:443
16-08-2019 12:12:46 DEBUG:https://pkk5.rosreestr.ru:443 "GET /api/features/1/66:41:514042:55 HTTP/1.1" 200 39
16-08-2019 12:12:46 DEBUG:Данных об участке нет
16-08-2019 12:15:23 DEBUG:Входная строка 1(координаты) 56.7093 60.591112
16-08-2019 12:15:23 DEBUG:Входная строка 2 1
16-08-2019 12:15:23 DEBUG:Lat 56.7093 Lon 60.591112
16-08-2019 12:15:23 DEBUG:Получение информации по координатам...
16-08-2019 12:15:23 DEBUG:Кадастровый номер: Участок
Адрес: 1
Координаты:
56,7093  	60,591112
56°42ʹ33ʺ с.ш. 60°35ʹ28ʺ в.д.
Лист М 1:200000 : O-41-25

https://yandex.ru/maps/?mode=search&text=56.7093%2C60.591112

file://d:/OziExplorer/data/CADASTER.txt
Datum,WGS 84
WP,D,Участок,56.7093  ,60.591112,08/16/19,12/15/23,,D,N,-9999

16-08-2019 12:16:43 DEBUG:Closed WebSocket
16-08-2019 12:16:44 DEBUG:Failed to write closing frame -> closing socket
16-08-2019 12:16:44 DEBUG:Closed WebSocket
10-09-2019 10:17:57 INFO:******************** Starting Cadastron v2.147 Build: 07-08-2019-08:59:17 ********************
10-09-2019 10:17:57 DEBUG:Initializing WebSocket
10-09-2019 10:17:57 DEBUG:Validating WebSocket request
10-09-2019 10:17:57 INFO:127.0.0.1 - - [2019-09-10 10:17:57] "GET /main-uikit.html HTTP/1.1" 200 9516 0.306301
10-09-2019 10:17:57 DEBUG:Initializing WebSocket
10-09-2019 10:17:57 DEBUG:Validating WebSocket request
10-09-2019 10:17:57 INFO:127.0.0.1 - - [2019-09-10 10:17:57] "GET /css/uikit.min.css HTTP/1.1" 200 253541 0.016954
10-09-2019 10:17:57 DEBUG:Initializing WebSocket
10-09-2019 10:17:57 DEBUG:Validating WebSocket request
10-09-2019 10:17:57 INFO:127.0.0.1 - - [2019-09-10 10:17:57] "GET /css/leaflet.css HTTP/1.1" 200 14292 0.021941
10-09-2019 10:17:57 DEBUG:Initializing WebSocket
10-09-2019 10:17:57 DEBUG:Validating WebSocket request
10-09-2019 10:17:57 INFO:127.0.0.1 - - [2019-09-10 10:17:57] "GET /css/main-uikit.css HTTP/1.1" 200 556 0.000997
10-09-2019 10:17:57 DEBUG:Initializing WebSocket
10-09-2019 10:17:57 DEBUG:Validating WebSocket request
10-09-2019 10:17:57 INFO:127.0.0.1 - - [2019-09-10 10:17:57] "GET /js/uikit-icons.min.js HTTP/1.1" 200 63621 0.000997
10-09-2019 10:17:57 DEBUG:Initializing WebSocket
10-09-2019 10:17:57 DEBUG:Validating WebSocket request
10-09-2019 10:17:57 INFO:127.0.0.1 - - [2019-09-10 10:17:57] "GET /js/jquery-3.3.1.min.js HTTP/1.1" 200 87114 0.000000
10-09-2019 10:17:57 DEBUG:Initializing WebSocket
10-09-2019 10:17:57 DEBUG:Validating WebSocket request
10-09-2019 10:17:57 INFO:127.0.0.1 - - [2019-09-10 10:17:57] "GET /js/uikit.min.js HTTP/1.1" 200 132179 0.000998
10-09-2019 10:17:57 DEBUG:Initializing WebSocket
10-09-2019 10:17:57 DEBUG:Validating WebSocket request
10-09-2019 10:17:58 INFO:127.0.0.1 - - [2019-09-10 10:17:58] "GET /js/leaflet.js HTTP/1.1" 200 141315 0.000997
10-09-2019 10:17:58 DEBUG:Initializing WebSocket
10-09-2019 10:17:58 DEBUG:Validating WebSocket request
10-09-2019 10:17:58 INFO:127.0.0.1 - - [2019-09-10 10:17:58] "GET /eel.js HTTP/1.1" 200 4803 0.000000
10-09-2019 10:17:58 DEBUG:Initializing WebSocket
10-09-2019 10:17:58 DEBUG:Validating WebSocket request
10-09-2019 10:17:58 INFO:127.0.0.1 - - [2019-09-10 10:17:58] "GET /js/script-uikit.js HTTP/1.1" 200 12495 0.000997
10-09-2019 10:17:58 DEBUG:Initializing WebSocket
10-09-2019 10:17:58 DEBUG:Validating WebSocket request
10-09-2019 10:17:58 INFO:127.0.0.1 - - [2019-09-10 10:17:58] "GET /favicon.ico HTTP/1.1" 200 15261 0.018949
10-09-2019 10:17:58 DEBUG:Initializing WebSocket
10-09-2019 10:17:58 DEBUG:Validating WebSocket request
10-09-2019 10:17:58 INFO:127.0.0.1 - - [2019-09-10 10:17:58] "GET /css/images/marker-icon.png HTTP/1.1" 200 1637 0.011968
10-09-2019 10:17:58 DEBUG:Initializing WebSocket
10-09-2019 10:17:58 DEBUG:Validating WebSocket request
10-09-2019 10:17:58 INFO:127.0.0.1 - - [2019-09-10 10:17:58] "GET /css/images/marker-shadow.png HTTP/1.1" 200 788 0.001995
10-09-2019 10:17:58 DEBUG:Initializing WebSocket
10-09-2019 10:17:58 DEBUG:Validating WebSocket request
10-09-2019 10:17:58 DEBUG:Attempting to upgrade connection
10-09-2019 10:17:58 DEBUG:WebSocket request accepted, switching protocols
10-09-2019 10:18:08 DEBUG:Введенный кад. номер: 66620301002431
10-09-2019 10:18:08 DEBUG:Starting new HTTP connection (1): pkk5.rosreestr.ru:80
10-09-2019 10:18:08 DEBUG:http://pkk5.rosreestr.ru:80 "POST /api/features/1/66:62:301002:431 HTTP/1.1" 301 0
10-09-2019 10:18:08 DEBUG:Starting new HTTPS connection (1): pkk5.rosreestr.ru:443
10-09-2019 10:18:09 DEBUG:https://pkk5.rosreestr.ru:443 "GET /api/features/1/66:62:301002:431 HTTP/1.1" 200 39
10-09-2019 10:18:09 DEBUG:Данных об участке нет
10-09-2019 10:20:07 DEBUG:Входная строка 1(координаты) 56.965841, 60.435075
10-09-2019 10:20:07 DEBUG:Входная строка 2 Коптяки
10-09-2019 10:20:07 DEBUG:Lat 56.965841 Lon 60.435075
10-09-2019 10:20:07 DEBUG:Получение информации по координатам...
10-09-2019 10:20:07 DEBUG:Кадастровый номер: Участок
Адрес: Коптяки
Координаты:
56,965841	60,435075
56°57ʹ57ʺ с.ш. 60°26ʹ06ʺ в.д.
Лист М 1:200000 : O-41-25

https://yandex.ru/maps/?mode=search&text=56.965841%2C60.435075

file://d:/OziExplorer/data/CADASTER.txt
Datum,WGS 84
WP,D,Участок,56.965841,60.435075,09/10/19,10/20/07,,D,N,-9999

10-09-2019 10:20:53 DEBUG:Адрес:Свердловская обл., ГО Среднеуральск, д. Коптяки, ул. Центральная, д.6
10-09-2019 10:20:53 DEBUG:Папка с отчетом:Коптяки ул. Центральная, д.6 Сентябрь 2019
10-09-2019 10:30:37 DEBUG:Closed WebSocket
10-09-2019 10:30:38 DEBUG:Failed to write closing frame -> closing socket
10-09-2019 10:30:38 DEBUG:Closed WebSocket
10-09-2019 10:31:08 INFO:******************** Starting Cadastron v2.147 Build: 07-08-2019-08:59:17 ********************
10-09-2019 10:31:09 DEBUG:Initializing WebSocket
10-09-2019 10:31:09 DEBUG:Validating WebSocket request
10-09-2019 10:31:09 INFO:127.0.0.1 - - [2019-09-10 10:31:09] "GET /eel.js HTTP/1.1" 200 4803 0.000000
10-09-2019 10:31:09 DEBUG:Initializing WebSocket
10-09-2019 10:31:09 DEBUG:Validating WebSocket request
10-09-2019 10:31:09 DEBUG:Attempting to upgrade connection
10-09-2019 10:31:09 DEBUG:WebSocket request accepted, switching protocols
10-09-2019 10:32:03 DEBUG:Входная строка 1(координаты) 56.719958, 60.774415
10-09-2019 10:32:03 DEBUG:Входная строка 2 Свердловская обл., Сысертский р-н, п. Большой Исток, ул. Заводская, дом 7-1
10-09-2019 10:32:03 DEBUG:Lat 56.719958 Lon 60.774415
10-09-2019 10:32:03 DEBUG:Получение информации по координатам...
10-09-2019 10:32:03 DEBUG:Кадастровый номер: Участок
Адрес: Свердловская обл., Сысертский р-н, п. Большой Исток, ул. Заводская, дом 7-1
Координаты:
56,719958	60,774415
56°43ʹ11ʺ с.ш. 60°46ʹ27ʺ в.д.
Лист М 1:200000 : O-41-25

https://yandex.ru/maps/?mode=search&text=56.719958%2C60.774415

file://d:/OziExplorer/data/CADASTER.txt
Datum,WGS 84
WP,D,Участок,56.719958,60.774415,09/10/19,10/32/03,,D,N,-9999

10-09-2019 10:32:51 DEBUG:Адрес:Свердловская обл., Сысертский р-н, п. Большой Исток, ул. Заводская, дом 7-1
10-09-2019 10:32:51 DEBUG:Папка с отчетом:Б.Исток, ул. Заводская, дом 7-1 Сентябрь 2019
10-09-2019 10:50:38 DEBUG:Closed WebSocket
10-09-2019 10:50:39 DEBUG:Failed to write closing frame -> closing socket
10-09-2019 10:50:39 DEBUG:Closed WebSocket
10-09-2019 10:50:41 INFO:******************** Starting Cadastron v2.147 Build: 07-08-2019-08:59:17 ********************
10-09-2019 10:50:41 DEBUG:Initializing WebSocket
10-09-2019 10:50:41 DEBUG:Validating WebSocket request
10-09-2019 10:50:41 INFO:127.0.0.1 - - [2019-09-10 10:50:41] "GET /eel.js HTTP/1.1" 200 4803 0.000998
10-09-2019 10:50:42 DEBUG:Initializing WebSocket
10-09-2019 10:50:42 DEBUG:Validating WebSocket request
10-09-2019 10:50:42 DEBUG:Attempting to upgrade connection
10-09-2019 10:50:42 DEBUG:WebSocket request accepted, switching protocols
10-09-2019 10:50:46 DEBUG:Введенный кад. номер: 66:62:0301003:42
10-09-2019 10:50:46 DEBUG:Starting new HTTP connection (1): pkk5.rosreestr.ru:80
10-09-2019 10:50:46 DEBUG:http://pkk5.rosreestr.ru:80 "POST /api/features/1/66:62:301003:42 HTTP/1.1" 301 0
10-09-2019 10:50:46 DEBUG:Starting new HTTPS connection (1): pkk5.rosreestr.ru:443
10-09-2019 10:50:46 DEBUG:https://pkk5.rosreestr.ru:443 "GET /api/features/1/66:62:301003:42 HTTP/1.1" 200 1971
10-09-2019 10:50:46 INFO:Кадастровый номер: 66:62:0301003:42
Адрес: Свердловская область, городской округ Среднеуральск, деревня Коптяки, квартал "Европейская деревня", улица Авангардная, дом 15
Координаты:
56,965967	60,421631
56°57ʹ57ʺ с.ш. 60°25ʹ17ʺ в.д.
Лист М 1:200000 : O-41-25

https://yandex.ru/maps/?mode=search&text=56.965967%2C60.421631

file://d:/OziExplorer/data/CADASTER.txt
Datum,WGS 84
WP,D,66:62:0301003:42,56.965967,60.421631,09/10/19,10/50/46,,D,N,-9999

10-09-2019 10:54:00 DEBUG:Адрес:Свердловская область, городской округ. Среднеуральск, д. Коптяки, квартал <<Европейская деревня>>, ул. Авангардная, 15
10-09-2019 10:54:00 DEBUG:Папка с отчетом:Коптяки, Европейская деревня, ул Авангардная, 15 Сентябрь 2019
10-09-2019 11:25:41 DEBUG:Введенный кад. номер: 66:62:0301003:35
10-09-2019 11:25:41 DEBUG:Starting new HTTP connection (1): pkk5.rosreestr.ru:80
10-09-2019 11:25:41 DEBUG:http://pkk5.rosreestr.ru:80 "POST /api/features/1/66:62:301003:35 HTTP/1.1" 301 0
10-09-2019 11:25:41 DEBUG:Starting new HTTPS connection (1): pkk5.rosreestr.ru:443
10-09-2019 11:25:41 DEBUG:https://pkk5.rosreestr.ru:443 "GET /api/features/1/66:62:301003:35 HTTP/1.1" 200 2356
10-09-2019 11:25:41 INFO:Кадастровый номер: 66:62:0301003:35
Адрес: Свердловская область, городской округ Среднеуральск, деревня Коптяки, квартал "Европейская деревня", улица Авангардная, дом 9
Координаты:
56,965225	60,419026
56°57ʹ54ʺ с.ш. 60°25ʹ08ʺ в.д.
Лист М 1:200000 : O-41-25

https://yandex.ru/maps/?mode=search&text=56.965225%2C60.419026

file://d:/OziExplorer/data/CADASTER.txt
Datum,WGS 84
WP,D,66:62:0301003:35,56.965225,60.419026,09/10/19,11/25/41,,D,N,-9999

10-09-2019 11:25:53 DEBUG:Closed WebSocket
10-09-2019 11:25:54 DEBUG:Failed to write closing frame -> closing socket
10-09-2019 11:25:54 DEBUG:Closed WebSocket
10-09-2019 11:25:58 INFO:******************** Starting Cadastron v2.147 Build: 07-08-2019-08:59:17 ********************
10-09-2019 11:25:59 DEBUG:Initializing WebSocket
10-09-2019 11:25:59 DEBUG:Validating WebSocket request
10-09-2019 11:25:59 INFO:127.0.0.1 - - [2019-09-10 11:25:59] "GET /eel.js HTTP/1.1" 200 4803 0.000000
10-09-2019 11:25:59 DEBUG:Initializing WebSocket
10-09-2019 11:25:59 DEBUG:Validating WebSocket request
10-09-2019 11:25:59 DEBUG:Attempting to upgrade connection
10-09-2019 11:25:59 DEBUG:WebSocket request accepted, switching protocols
10-09-2019 11:26:11 DEBUG:Введенный кад. номер: 6662030100335
10-09-2019 11:26:11 DEBUG:Starting new HTTP connection (1): pkk5.rosreestr.ru:80
10-09-2019 11:26:11 DEBUG:http://pkk5.rosreestr.ru:80 "POST /api/features/1/66:62:301003:35 HTTP/1.1" 301 0
10-09-2019 11:26:11 DEBUG:Starting new HTTPS connection (1): pkk5.rosreestr.ru:443
10-09-2019 11:26:11 DEBUG:https://pkk5.rosreestr.ru:443 "GET /api/features/1/66:62:301003:35 HTTP/1.1" 200 2356
10-09-2019 11:26:11 INFO:Кадастровый номер: 66:62:0301003:35
Адрес: Свердловская область, городской округ Среднеуральск, деревня Коптяки, квартал "Европейская деревня", улица Авангардная, дом 9
Координаты:
56,965225	60,419026
56°57ʹ54ʺ с.ш. 60°25ʹ08ʺ в.д.
Лист М 1:200000 : O-41-25

https://yandex.ru/maps/?mode=search&text=56.965225%2C60.419026

file://d:/OziExplorer/data/CADASTER.txt
Datum,WGS 84
WP,D,66:62:0301003:35,56.965225,60.419026,09/10/19,11/26/11,,D,N,-9999

10-09-2019 11:27:19 DEBUG:Адрес:Свердловская обл., ГО Среднеуральск, д. Коптяки, <<Европейская деревня>>, ул. Авангардная, 9
10-09-2019 11:27:19 DEBUG:Папка с отчетом:Коптяки, квартал Европейская деревня, улица Авангардная, дом 9 Сентябрь 2019
10-09-2019 11:28:16 DEBUG:Closed WebSocket
10-09-2019 11:28:17 DEBUG:Failed to write closing frame -> closing socket
10-09-2019 11:28:17 DEBUG:Closed WebSocket
10-09-2019 11:33:11 INFO:******************** Starting Cadastron v2.147 Build: 07-08-2019-08:59:17 ********************
10-09-2019 11:33:11 DEBUG:Initializing WebSocket
10-09-2019 11:33:11 DEBUG:Validating WebSocket request
10-09-2019 11:33:11 INFO:127.0.0.1 - - [2019-09-10 11:33:11] "GET /eel.js HTTP/1.1" 200 4803 0.000000
10-09-2019 11:33:11 DEBUG:Initializing WebSocket
10-09-2019 11:33:11 DEBUG:Validating WebSocket request
10-09-2019 11:33:11 DEBUG:Attempting to upgrade connection
10-09-2019 11:33:11 DEBUG:WebSocket request accepted, switching protocols
10-09-2019 11:33:30 DEBUG:Введенный кад. номер: 6606450100184
10-09-2019 11:33:30 DEBUG:Starting new HTTP connection (1): pkk5.rosreestr.ru:80
10-09-2019 11:33:30 DEBUG:http://pkk5.rosreestr.ru:80 "POST /api/features/1/66:6:4501001:84 HTTP/1.1" 301 0
10-09-2019 11:33:30 DEBUG:Starting new HTTPS connection (1): pkk5.rosreestr.ru:443
10-09-2019 11:33:30 DEBUG:https://pkk5.rosreestr.ru:443 "GET /api/features/1/66:6:4501001:84 HTTP/1.1" 200 2399
10-09-2019 11:33:30 INFO:Кадастровый номер: 66:06:4501001:84
Адрес: обл. Свердловская, р-н Белоярский, п. Растущий, м-н Дорожник-4 ул Коллективная, дом 2
Координаты:
56,782524	60,959716
56°46ʹ57ʺ с.ш. 60°57ʹ34ʺ в.д.
Лист М 1:200000 : O-41-25

https://yandex.ru/maps/?mode=search&text=56.782524%2C60.959716

file://d:/OziExplorer/data/CADASTER.txt
Datum,WGS 84
WP,D,66:06:4501001:84,56.782524,60.959716,09/10/19,11/33/30,,D,N,-9999

10-09-2019 11:36:13 DEBUG:Адрес:Свердловская обл., Белоярский р-н, п. Растущий, м-н Дорожник-4 ул Коллективная, дом 2
10-09-2019 11:36:13 DEBUG:Папка с отчетом:Растущий м-н Дорожник-4 ул Коллективная, дом 2 Сентябрь 2019
10-09-2019 11:46:18 DEBUG:Closed WebSocket
10-09-2019 11:46:19 DEBUG:Failed to write closing frame -> closing socket
10-09-2019 11:46:19 DEBUG:Closed WebSocket
10-09-2019 11:46:23 INFO:******************** Starting Cadastron v2.147 Build: 07-08-2019-08:59:17 ********************
10-09-2019 11:46:23 DEBUG:Initializing WebSocket
10-09-2019 11:46:23 DEBUG:Validating WebSocket request
10-09-2019 11:46:23 INFO:127.0.0.1 - - [2019-09-10 11:46:23] "GET /eel.js HTTP/1.1" 200 4803 0.000997
10-09-2019 11:46:24 DEBUG:Initializing WebSocket
10-09-2019 11:46:24 DEBUG:Validating WebSocket request
10-09-2019 11:46:24 DEBUG:Attempting to upgrade connection
10-09-2019 11:46:24 DEBUG:WebSocket request accepted, switching protocols
10-09-2019 11:46:38 DEBUG:Введенный кад. номер: 66582902078129
10-09-2019 11:46:38 DEBUG:Starting new HTTP connection (1): pkk5.rosreestr.ru:80
10-09-2019 11:46:38 DEBUG:http://pkk5.rosreestr.ru:80 "POST /api/features/1/66:58:2902078:129 HTTP/1.1" 301 0
10-09-2019 11:46:38 DEBUG:Starting new HTTPS connection (1): pkk5.rosreestr.ru:443
10-09-2019 11:46:38 DEBUG:https://pkk5.rosreestr.ru:443 "GET /api/features/1/66:58:2902078:129 HTTP/1.1" 200 2265
10-09-2019 11:46:38 INFO:Кадастровый номер: 66:58:2902078:129
Адрес: Свердловская область, город Первоуральск, садоводческое товарищество "Автомобилист", участок 5
Координаты:
56,802031	60,30104 
56°48ʹ07ʺ с.ш. 60°18ʹ03ʺ в.д.
Лист М 1:200000 : O-41-25

https://yandex.ru/maps/?mode=search&text=56.802031%2C60.30104

file://d:/OziExplorer/data/CADASTER.txt
Datum,WGS 84
WP,D,66:58:2902078:129,56.802031,60.30104 ,09/10/19,11/46/38,,D,N,-9999

10-09-2019 11:47:32 DEBUG:Адрес:Свердловская обл., г. Первоуральск, СТ <<Автомобилист>>, уч. 5
10-09-2019 11:47:32 DEBUG:Папка с отчетом:Первоуральск, СТ Автомобилист, уч 5 Сентябрь 2019
10-09-2019 11:49:01 DEBUG:Closed WebSocket
10-09-2019 11:49:02 DEBUG:Failed to write closing frame -> closing socket
10-09-2019 11:49:02 DEBUG:Closed WebSocket
10-09-2019 11:56:20 INFO:******************** Starting Cadastron v2.147 Build: 07-08-2019-08:59:17 ********************
10-09-2019 11:56:21 DEBUG:Initializing WebSocket
10-09-2019 11:56:21 DEBUG:Validating WebSocket request
10-09-2019 11:56:21 INFO:127.0.0.1 - - [2019-09-10 11:56:21] "GET /eel.js HTTP/1.1" 200 4803 0.001004
10-09-2019 11:56:21 DEBUG:Initializing WebSocket
10-09-2019 11:56:21 DEBUG:Validating WebSocket request
10-09-2019 11:56:21 DEBUG:Attempting to upgrade connection
10-09-2019 11:56:21 DEBUG:WebSocket request accepted, switching protocols
10-09-2019 11:56:25 DEBUG:Введенный кад. номер: 66:58:2902078:129
10-09-2019 11:56:25 DEBUG:Starting new HTTP connection (1): pkk5.rosreestr.ru:80
10-09-2019 11:56:25 DEBUG:http://pkk5.rosreestr.ru:80 "POST /api/features/1/66:58:2902078:129 HTTP/1.1" 301 0
10-09-2019 11:56:25 DEBUG:Starting new HTTPS connection (1): pkk5.rosreestr.ru:443
10-09-2019 11:56:26 DEBUG:https://pkk5.rosreestr.ru:443 "GET /api/features/1/66:58:2902078:129 HTTP/1.1" 200 2265
10-09-2019 11:56:26 INFO:Кадастровый номер: 66:58:2902078:129
Адрес: Свердловская область, город Первоуральск, садоводческое товарищество "Автомобилист", участок 5
Координаты:
56,802031	60,30104 
56°48ʹ07ʺ с.ш. 60°18ʹ03ʺ в.д.
Лист М 1:200000 : O-41-25

https://yandex.ru/maps/?mode=search&text=56.802031%2C60.30104

file://d:/OziExplorer/data/CADASTER.txt
Datum,WGS 84
WP,D,66:58:2902078:129,56.802031,60.30104 ,09/10/19,11/56/26,,D,N,-9999

10-09-2019 11:59:19 DEBUG:Closed WebSocket
10-09-2019 11:59:20 DEBUG:Failed to write closing frame -> closing socket
10-09-2019 11:59:20 DEBUG:Closed WebSocket
10-09-2019 12:07:04 INFO:******************** Starting Cadastron v2.147 Build: 07-08-2019-08:59:17 ********************
10-09-2019 12:07:04 DEBUG:Initializing WebSocket
10-09-2019 12:07:04 DEBUG:Validating WebSocket request
10-09-2019 12:07:04 INFO:127.0.0.1 - - [2019-09-10 12:07:04] "GET /eel.js HTTP/1.1" 200 4803 0.000000
10-09-2019 12:07:05 DEBUG:Initializing WebSocket
10-09-2019 12:07:05 DEBUG:Validating WebSocket request
10-09-2019 12:07:05 DEBUG:Attempting to upgrade connection
10-09-2019 12:07:05 DEBUG:WebSocket request accepted, switching protocols
10-09-2019 12:07:21 DEBUG:Входная строка 1(координаты) 57.484603, 61.445480
10-09-2019 12:07:21 DEBUG:Входная строка 2 Ощепково
10-09-2019 12:07:21 DEBUG:Lat 57.484603 Lon 61.445480
10-09-2019 12:07:21 DEBUG:Получение информации по координатам...
10-09-2019 12:07:21 DEBUG:Кадастровый номер: Участок
Адрес: Ощепково
Координаты:
57,484603	61,445480
57°29ʹ04ʺ с.ш. 61°26ʹ43ʺ в.д.
Лист М 1:200000 : O-41-20

https://yandex.ru/maps/?mode=search&text=57.484603%2C61.445480

file://d:/OziExplorer/data/CADASTER.txt
Datum,WGS 84
WP,D,Участок,57.484603,61.445480,09/10/19,12/07/21,,D,N,-9999

10-09-2019 12:08:50 DEBUG:Адрес:Свердловская обл., Режевской р-н, д.Ощепково, пер. Ясный
10-09-2019 12:08:50 DEBUG:Папка с отчетом:Режевской район Ощепково Сентябрь 2019
10-09-2019 12:15:47 DEBUG:Closed WebSocket
10-09-2019 12:15:48 DEBUG:Failed to write closing frame -> closing socket
10-09-2019 12:15:48 DEBUG:Closed WebSocket
10-09-2019 12:15:54 INFO:******************** Starting Cadastron v2.147 Build: 07-08-2019-08:59:17 ********************
10-09-2019 12:15:54 DEBUG:Initializing WebSocket
10-09-2019 12:15:54 DEBUG:Validating WebSocket request
10-09-2019 12:15:54 INFO:127.0.0.1 - - [2019-09-10 12:15:54] "GET /eel.js HTTP/1.1" 200 4803 0.000000
10-09-2019 12:15:55 DEBUG:Initializing WebSocket
10-09-2019 12:15:55 DEBUG:Validating WebSocket request
10-09-2019 12:15:55 DEBUG:Attempting to upgrade connection
10-09-2019 12:15:55 DEBUG:WebSocket request accepted, switching protocols
10-09-2019 12:16:08 DEBUG:Введенный кад. номер: 6606450100184
10-09-2019 12:16:08 DEBUG:Starting new HTTP connection (1): pkk5.rosreestr.ru:80
10-09-2019 12:16:08 DEBUG:http://pkk5.rosreestr.ru:80 "POST /api/features/1/66:6:4501001:84 HTTP/1.1" 301 0
10-09-2019 12:16:08 DEBUG:Starting new HTTPS connection (1): pkk5.rosreestr.ru:443
10-09-2019 12:16:08 DEBUG:https://pkk5.rosreestr.ru:443 "GET /api/features/1/66:6:4501001:84 HTTP/1.1" 200 2399
10-09-2019 12:16:08 INFO:Кадастровый номер: 66:06:4501001:84
Адрес: обл. Свердловская, р-н Белоярский, п. Растущий, м-н Дорожник-4 ул Коллективная, дом 2
Координаты:
56,782524	60,959716
56°46ʹ57ʺ с.ш. 60°57ʹ34ʺ в.д.
Лист М 1:200000 : O-41-25

https://yandex.ru/maps/?mode=search&text=56.782524%2C60.959716

file://d:/OziExplorer/data/CADASTER.txt
Datum,WGS 84
WP,D,66:06:4501001:84,56.782524,60.959716,09/10/19,12/16/08,,D,N,-9999

10-09-2019 12:16:54 DEBUG:Адрес:Свердловская обл., Белоярский р-н, п. Растущий, м-н Дорожник-4 ул. Коллективная, дом 2
10-09-2019 12:16:54 DEBUG:Папка с отчетом:Растущий, м-н Дорожник-4 ул Коллективная, дом 2 Сентябрь 2019
10-09-2019 12:20:13 INFO:******************** Starting Cadastron v2.147 Build: 07-08-2019-08:59:17 ********************
10-09-2019 12:20:13 DEBUG:Initializing WebSocket
10-09-2019 12:20:13 DEBUG:Validating WebSocket request
10-09-2019 12:20:13 INFO:127.0.0.1 - - [2019-09-10 12:20:13] "GET /eel.js HTTP/1.1" 200 4803 0.000000
10-09-2019 12:20:14 DEBUG:Initializing WebSocket
10-09-2019 12:20:14 DEBUG:Validating WebSocket request
10-09-2019 12:20:14 DEBUG:Attempting to upgrade connection
10-09-2019 12:20:14 DEBUG:WebSocket request accepted, switching protocols
10-09-2019 12:20:27 DEBUG:Введенный кад. номер: 66251321002179
10-09-2019 12:20:27 DEBUG:Starting new HTTP connection (1): pkk5.rosreestr.ru:80
10-09-2019 12:20:27 DEBUG:http://pkk5.rosreestr.ru:80 "POST /api/features/1/66:25:1321002:179 HTTP/1.1" 301 0
10-09-2019 12:20:27 DEBUG:Starting new HTTPS connection (1): pkk5.rosreestr.ru:443
10-09-2019 12:20:27 DEBUG:https://pkk5.rosreestr.ru:443 "GET /api/features/1/66:25:1321002:179 HTTP/1.1" 200 2524
10-09-2019 12:20:27 INFO:Кадастровый номер: 66:25:1321002:179
Адрес: Свердловская обл., в Сысертском районе, участок находится примерно в 1 км. по направлению на северо-запад от ориентира поселок Колос, участок 137
Координаты:
56,613626	61,021805
56°36ʹ49ʺ с.ш. 61°01ʹ18ʺ в.д.
Лист М 1:200000 : O-41-32

https://yandex.ru/maps/?mode=search&text=56.613626%2C61.021805

file://d:/OziExplorer/data/CADASTER.txt
Datum,WGS 84
WP,D,66:25:1321002:179,56.613626,61.021805,09/10/19,12/20/27,,D,N,-9999

10-09-2019 12:22:06 DEBUG:Адрес:Свердловская обл., Сысертский р-н, в 1 км. на северо-запад от пос. Колос, участок 137
10-09-2019 12:22:06 DEBUG:Папка с отчетом:Новофомино, участок 137 Сентябрь 2019
10-09-2019 12:27:23 DEBUG:Closed WebSocket
10-09-2019 12:27:24 DEBUG:Failed to write closing frame -> closing socket
10-09-2019 12:27:24 DEBUG:Closed WebSocket
10-09-2019 12:27:25 DEBUG:Closed WebSocket
10-09-2019 12:27:26 DEBUG:Failed to write closing frame -> closing socket
10-09-2019 12:27:26 DEBUG:Closed WebSocket
10-09-2019 02:16:20 INFO:******************** Starting Cadastron v2.147 Build: 07-08-2019-08:59:17 ********************
10-09-2019 02:16:20 DEBUG:Initializing WebSocket
10-09-2019 02:16:20 DEBUG:Validating WebSocket request
10-09-2019 02:16:20 INFO:127.0.0.1 - - [2019-09-10 14:16:20] "GET /eel.js HTTP/1.1" 200 4803 0.000000
10-09-2019 02:16:20 DEBUG:Initializing WebSocket
10-09-2019 02:16:20 DEBUG:Validating WebSocket request
10-09-2019 02:16:20 DEBUG:Attempting to upgrade connection
10-09-2019 02:16:20 DEBUG:WebSocket request accepted, switching protocols
10-09-2019 02:16:32 DEBUG:Введенный кад. номер: 6641031009744
10-09-2019 02:16:32 DEBUG:Starting new HTTP connection (1): pkk5.rosreestr.ru:80
10-09-2019 02:16:32 DEBUG:http://pkk5.rosreestr.ru:80 "POST /api/features/1/66:41:310097:44 HTTP/1.1" 301 0
10-09-2019 02:16:32 DEBUG:Starting new HTTPS connection (1): pkk5.rosreestr.ru:443
10-09-2019 02:16:33 DEBUG:https://pkk5.rosreestr.ru:443 "GET /api/features/1/66:41:310097:44 HTTP/1.1" 200 1584
10-09-2019 02:16:33 INFO:Кадастровый номер: 66:41:0310097:44
Адрес: обл. Свердловская, г. Екатеринбург,  к/с фабрики "Спортодежда", уч. № 44
Координаты:
56,765475	60,352008
56°45ʹ55ʺ с.ш. 60°21ʹ07ʺ в.д.
Лист М 1:200000 : O-41-25

https://yandex.ru/maps/?mode=search&text=56.765475%2C60.352008

file://d:/OziExplorer/data/CADASTER.txt
Datum,WGS 84
WP,D,66:41:0310097:44,56.765475,60.352008,09/10/19,14/16/33,,D,N,-9999

10-09-2019 02:17:46 DEBUG:Адрес:Свердловская обл., г. Екатеринбург,  к/с фабрики "Спортодежда", уч. № 44
10-09-2019 02:17:46 DEBUG:Папка с отчетом:СНТ Спортодежда, уч. 44 Сентябрь 2019
10-09-2019 02:21:56 DEBUG:Closed WebSocket
10-09-2019 02:21:57 DEBUG:Failed to write closing frame -> closing socket
10-09-2019 02:21:57 DEBUG:Closed WebSocket
10-09-2019 02:21:59 INFO:******************** Starting Cadastron v2.147 Build: 07-08-2019-08:59:17 ********************
10-09-2019 02:22:00 DEBUG:Initializing WebSocket
10-09-2019 02:22:00 DEBUG:Validating WebSocket request
10-09-2019 02:22:00 INFO:127.0.0.1 - - [2019-09-10 14:22:00] "GET /eel.js HTTP/1.1" 200 4803 0.000000
10-09-2019 02:22:00 DEBUG:Initializing WebSocket
10-09-2019 02:22:00 DEBUG:Validating WebSocket request
10-09-2019 02:22:00 DEBUG:Attempting to upgrade connection
10-09-2019 02:22:00 DEBUG:WebSocket request accepted, switching protocols
10-09-2019 02:22:10 DEBUG:Введенный кад. номер: 66410310064211
10-09-2019 02:22:10 DEBUG:Starting new HTTP connection (1): pkk5.rosreestr.ru:80
10-09-2019 02:22:11 DEBUG:http://pkk5.rosreestr.ru:80 "POST /api/features/1/66:41:310064:211 HTTP/1.1" 301 0
10-09-2019 02:22:11 DEBUG:Starting new HTTPS connection (1): pkk5.rosreestr.ru:443
10-09-2019 02:22:11 DEBUG:https://pkk5.rosreestr.ru:443 "GET /api/features/1/66:41:310064:211 HTTP/1.1" 200 1959
10-09-2019 02:22:11 INFO:Кадастровый номер: 66:41:0310064:211
Адрес: обл. Свердловская, г. Екатеринбург,  к/с "УВД-2"
Координаты:
56,777279	60,354832
56°46ʹ38ʺ с.ш. 60°21ʹ17ʺ в.д.
Лист М 1:200000 : O-41-25

https://yandex.ru/maps/?mode=search&text=56.777279%2C60.354832

file://d:/OziExplorer/data/CADASTER.txt
Datum,WGS 84
WP,D,66:41:0310064:211,56.777279,60.354832,09/10/19,14/22/11,,D,N,-9999

10-09-2019 02:23:27 DEBUG:Адрес:Свердловская обл., г. Екатеринбург,  к/с <<УВД-2>>
10-09-2019 02:23:27 DEBUG:Папка с отчетом:Екатеринбург КС УВД-2 Сентябрь 2019
10-09-2019 02:37:30 DEBUG:Closed WebSocket
10-09-2019 02:37:31 DEBUG:Failed to write closing frame -> closing socket
10-09-2019 02:37:31 DEBUG:Closed WebSocket
11-09-2019 10:05:17 INFO:******************** Starting Cadastron v2.147 Build: 07-08-2019-08:59:17 ********************
11-09-2019 10:05:17 DEBUG:Initializing WebSocket
11-09-2019 10:05:17 DEBUG:Validating WebSocket request
11-09-2019 10:05:18 INFO:127.0.0.1 - - [2019-09-11 10:05:18] "GET /main-uikit.html HTTP/1.1" 200 9516 0.314134
11-09-2019 10:05:18 DEBUG:Initializing WebSocket
11-09-2019 10:05:18 DEBUG:Validating WebSocket request
11-09-2019 10:05:18 INFO:127.0.0.1 - - [2019-09-11 10:05:18] "GET /css/uikit.min.css HTTP/1.1" 200 253541 0.015957
11-09-2019 10:05:18 DEBUG:Initializing WebSocket
11-09-2019 10:05:18 DEBUG:Validating WebSocket request
11-09-2019 10:05:18 INFO:127.0.0.1 - - [2019-09-11 10:05:18] "GET /css/leaflet.css HTTP/1.1" 200 14292 0.020943
11-09-2019 10:05:18 DEBUG:Initializing WebSocket
11-09-2019 10:05:18 DEBUG:Validating WebSocket request
11-09-2019 10:05:18 INFO:127.0.0.1 - - [2019-09-11 10:05:18] "GET /css/main-uikit.css HTTP/1.1" 200 556 0.000997
11-09-2019 10:05:18 DEBUG:Initializing WebSocket
11-09-2019 10:05:18 DEBUG:Validating WebSocket request
11-09-2019 10:05:18 INFO:127.0.0.1 - - [2019-09-11 10:05:18] "GET /js/uikit-icons.min.js HTTP/1.1" 200 63621 0.000997
11-09-2019 10:05:18 DEBUG:Initializing WebSocket
11-09-2019 10:05:18 DEBUG:Validating WebSocket request
11-09-2019 10:05:18 INFO:127.0.0.1 - - [2019-09-11 10:05:18] "GET /js/jquery-3.3.1.min.js HTTP/1.1" 200 87114 0.000000
11-09-2019 10:05:18 DEBUG:Initializing WebSocket
11-09-2019 10:05:18 DEBUG:Validating WebSocket request
11-09-2019 10:05:18 INFO:127.0.0.1 - - [2019-09-11 10:05:18] "GET /js/uikit.min.js HTTP/1.1" 200 132179 0.000997
11-09-2019 10:05:18 DEBUG:Initializing WebSocket
11-09-2019 10:05:18 DEBUG:Validating WebSocket request
11-09-2019 10:05:18 INFO:127.0.0.1 - - [2019-09-11 10:05:18] "GET /js/leaflet.js HTTP/1.1" 200 141315 0.000998
11-09-2019 10:05:18 DEBUG:Initializing WebSocket
11-09-2019 10:05:18 DEBUG:Validating WebSocket request
11-09-2019 10:05:18 INFO:127.0.0.1 - - [2019-09-11 10:05:18] "GET /eel.js HTTP/1.1" 200 4803 0.000000
11-09-2019 10:05:18 DEBUG:Initializing WebSocket
11-09-2019 10:05:18 DEBUG:Validating WebSocket request
11-09-2019 10:05:18 INFO:127.0.0.1 - - [2019-09-11 10:05:18] "GET /js/script-uikit.js HTTP/1.1" 200 12495 0.000997
11-09-2019 10:05:18 DEBUG:Initializing WebSocket
11-09-2019 10:05:18 DEBUG:Validating WebSocket request
11-09-2019 10:05:18 INFO:127.0.0.1 - - [2019-09-11 10:05:18] "GET /favicon.ico HTTP/1.1" 200 15261 0.019951
11-09-2019 10:05:18 DEBUG:Initializing WebSocket
11-09-2019 10:05:18 DEBUG:Validating WebSocket request
11-09-2019 10:05:18 INFO:127.0.0.1 - - [2019-09-11 10:05:18] "GET /css/images/marker-icon.png HTTP/1.1" 200 1637 0.018949
11-09-2019 10:05:18 DEBUG:Initializing WebSocket
11-09-2019 10:05:18 DEBUG:Validating WebSocket request
11-09-2019 10:05:18 INFO:127.0.0.1 - - [2019-09-11 10:05:18] "GET /css/images/marker-shadow.png HTTP/1.1" 200 788 0.001995
11-09-2019 10:05:18 DEBUG:Initializing WebSocket
11-09-2019 10:05:18 DEBUG:Validating WebSocket request
11-09-2019 10:05:18 DEBUG:Attempting to upgrade connection
11-09-2019 10:05:18 DEBUG:WebSocket request accepted, switching protocols
11-09-2019 10:05:45 DEBUG:Введенный кад. номер: 66410509014152
11-09-2019 10:05:45 DEBUG:Starting new HTTP connection (1): pkk5.rosreestr.ru:80
11-09-2019 10:05:45 DEBUG:http://pkk5.rosreestr.ru:80 "POST /api/features/1/66:41:509014:152 HTTP/1.1" 301 0
11-09-2019 10:05:45 DEBUG:Starting new HTTPS connection (1): pkk5.rosreestr.ru:443
11-09-2019 10:05:45 DEBUG:https://pkk5.rosreestr.ru:443 "GET /api/features/1/66:41:509014:152 HTTP/1.1" 200 1822
11-09-2019 10:05:45 INFO:Кадастровый номер: 66:41:0509014:152
Адрес: обл. Свердловская, г. Екатеринбург, СНТ "Березка",  участок 165
Координаты:
56,742292	60,753735
56°44ʹ32ʺ с.ш. 60°45ʹ13ʺ в.д.
Лист М 1:200000 : O-41-25

https://yandex.ru/maps/?mode=search&text=56.742292%2C60.753735

file://d:/OziExplorer/data/CADASTER.txt
Datum,WGS 84
WP,D,66:41:0509014:152,56.742292,60.753735,09/11/19,10/05/45,,D,N,-9999

11-09-2019 10:08:08 DEBUG:Адрес:Свердловская обл., г. Екатеринбург, СНТ <<Березка>>,  участок 165
11-09-2019 10:08:08 DEBUG:Папка с отчетом:Екатеринбург СНТ Березка (севернее Б.Истока)  уч 165 Сентябрь 2019
11-09-2019 10:12:04 DEBUG:Closed WebSocket
11-09-2019 10:12:05 DEBUG:Failed to write closing frame -> closing socket
11-09-2019 10:12:05 DEBUG:Closed WebSocket
11-09-2019 10:13:13 INFO:******************** Starting Cadastron v2.147 Build: 07-08-2019-08:59:17 ********************
11-09-2019 10:13:14 DEBUG:Initializing WebSocket
11-09-2019 10:13:14 DEBUG:Validating WebSocket request
11-09-2019 10:13:14 INFO:127.0.0.1 - - [2019-09-11 10:13:14] "GET /eel.js HTTP/1.1" 200 4803 0.000998
11-09-2019 10:13:14 DEBUG:Initializing WebSocket
11-09-2019 10:13:14 DEBUG:Validating WebSocket request
11-09-2019 10:13:14 DEBUG:Attempting to upgrade connection
11-09-2019 10:13:14 DEBUG:WebSocket request accepted, switching protocols
11-09-2019 10:13:25 DEBUG:Введенный кад. номер: 6641031009730
11-09-2019 10:13:25 DEBUG:Starting new HTTP connection (1): pkk5.rosreestr.ru:80
11-09-2019 10:13:25 DEBUG:http://pkk5.rosreestr.ru:80 "POST /api/features/1/66:41:310097:30 HTTP/1.1" 301 0
11-09-2019 10:13:25 DEBUG:Starting new HTTPS connection (1): pkk5.rosreestr.ru:443
11-09-2019 10:13:25 DEBUG:https://pkk5.rosreestr.ru:443 "GET /api/features/1/66:41:310097:30 HTTP/1.1" 200 2047
11-09-2019 10:13:25 INFO:Кадастровый номер: 66:41:0310097:30
Адрес: обл. Свердловская, г. Екатеринбург,  коллективный сад ф-ки "Спортодежда", уч. № 30
Координаты:
56,766423	60,352855
56°45ʹ59ʺ с.ш. 60°21ʹ10ʺ в.д.
Лист М 1:200000 : O-41-25

https://yandex.ru/maps/?mode=search&text=56.766423%2C60.352855

file://d:/OziExplorer/data/CADASTER.txt
Datum,WGS 84
WP,D,66:41:0310097:30,56.766423,60.352855,09/11/19,10/13/25,,D,N,-9999

11-09-2019 10:15:27 DEBUG:Closed WebSocket
11-09-2019 10:15:28 DEBUG:Failed to write closing frame -> closing socket
11-09-2019 10:15:28 DEBUG:Closed WebSocket
11-09-2019 12:03:53 INFO:******************** Starting Cadastron v2.147 Build: 07-08-2019-08:59:17 ********************
11-09-2019 12:03:54 DEBUG:Initializing WebSocket
11-09-2019 12:03:54 DEBUG:Validating WebSocket request
11-09-2019 12:03:54 INFO:127.0.0.1 - - [2019-09-11 12:03:54] "GET /eel.js HTTP/1.1" 200 4803 0.000997
11-09-2019 12:03:54 DEBUG:Initializing WebSocket
11-09-2019 12:03:54 DEBUG:Validating WebSocket request
11-09-2019 12:03:54 DEBUG:Attempting to upgrade connection
11-09-2019 12:03:54 DEBUG:WebSocket request accepted, switching protocols
11-09-2019 12:04:02 DEBUG:Введенный кад. номер: 6606450400847
11-09-2019 12:04:02 DEBUG:Starting new HTTP connection (1): pkk5.rosreestr.ru:80
11-09-2019 12:04:02 DEBUG:http://pkk5.rosreestr.ru:80 "POST /api/features/1/66:6:4504008:47 HTTP/1.1" 301 0
11-09-2019 12:04:02 DEBUG:Starting new HTTPS connection (1): pkk5.rosreestr.ru:443
11-09-2019 12:04:02 DEBUG:https://pkk5.rosreestr.ru:443 "GET /api/features/1/66:6:4504008:47 HTTP/1.1" 200 1560
11-09-2019 12:04:02 DEBUG:Ошибка get_info(): KeyError('center')
11-09-2019 12:09:09 DEBUG:Введенный кад. номер: 6606450400828
11-09-2019 12:09:09 DEBUG:Starting new HTTP connection (1): pkk5.rosreestr.ru:80
11-09-2019 12:09:09 DEBUG:http://pkk5.rosreestr.ru:80 "POST /api/features/1/66:6:4504008:28 HTTP/1.1" 301 0
11-09-2019 12:09:09 DEBUG:Starting new HTTPS connection (1): pkk5.rosreestr.ru:443
11-09-2019 12:09:09 DEBUG:https://pkk5.rosreestr.ru:443 "GET /api/features/1/66:6:4504008:28 HTTP/1.1" 200 1629
11-09-2019 12:09:09 INFO:Кадастровый номер: 66:06:4504008:28
Адрес: обл. Свердловская, р-н Белоярский, коллективный сад "Мечта",  уч. 66
Координаты:
56,612997	61,215066
56°36ʹ46ʺ с.ш. 61°12ʹ54ʺ в.д.
Лист М 1:200000 : O-41-32

https://yandex.ru/maps/?mode=search&text=56.612997%2C61.215066

file://d:/OziExplorer/data/CADASTER.txt
Datum,WGS 84
WP,D,66:06:4504008:28,56.612997,61.215066,09/11/19,12/09/09,,D,N,-9999

11-09-2019 12:11:23 DEBUG:Адрес:Свердловская обл., Белоярский р-н, коллективный сад <<Мечта>>,  уч. 67
11-09-2019 12:11:23 DEBUG:Папка с отчетом:Шиши СНТ Мечта, уч 67 Сентябрь 2019
11-09-2019 12:14:09 DEBUG:Closed WebSocket
11-09-2019 12:14:10 DEBUG:Failed to write closing frame -> closing socket
11-09-2019 12:14:10 DEBUG:Closed WebSocket
12-09-2019 11:18:37 INFO:******************** Starting Cadastron v2.147 Build: 07-08-2019-08:59:17 ********************
12-09-2019 11:18:38 DEBUG:Initializing WebSocket
12-09-2019 11:18:38 DEBUG:Validating WebSocket request
12-09-2019 11:18:38 INFO:127.0.0.1 - - [2019-09-12 11:18:38] "GET /main-uikit.html HTTP/1.1" 200 9516 0.346111
12-09-2019 11:18:38 DEBUG:Initializing WebSocket
12-09-2019 11:18:38 DEBUG:Validating WebSocket request
12-09-2019 11:18:38 INFO:127.0.0.1 - - [2019-09-12 11:18:38] "GET /css/uikit.min.css HTTP/1.1" 200 253541 0.017950
12-09-2019 11:18:38 DEBUG:Initializing WebSocket
12-09-2019 11:18:38 DEBUG:Validating WebSocket request
12-09-2019 11:18:38 INFO:127.0.0.1 - - [2019-09-12 11:18:38] "GET /css/leaflet.css HTTP/1.1" 200 14292 0.020451
12-09-2019 11:18:38 DEBUG:Initializing WebSocket
12-09-2019 11:18:38 DEBUG:Validating WebSocket request
12-09-2019 11:18:38 INFO:127.0.0.1 - - [2019-09-12 11:18:38] "GET /css/main-uikit.css HTTP/1.1" 200 556 0.000997
12-09-2019 11:18:38 DEBUG:Initializing WebSocket
12-09-2019 11:18:38 DEBUG:Validating WebSocket request
12-09-2019 11:18:38 INFO:127.0.0.1 - - [2019-09-12 11:18:38] "GET /js/uikit-icons.min.js HTTP/1.1" 200 63621 0.000988
12-09-2019 11:18:38 DEBUG:Initializing WebSocket
12-09-2019 11:18:38 DEBUG:Validating WebSocket request
12-09-2019 11:18:38 INFO:127.0.0.1 - - [2019-09-12 11:18:38] "GET /js/jquery-3.3.1.min.js HTTP/1.1" 200 87114 0.000998
12-09-2019 11:18:38 DEBUG:Initializing WebSocket
12-09-2019 11:18:38 DEBUG:Validating WebSocket request
12-09-2019 11:18:38 INFO:127.0.0.1 - - [2019-09-12 11:18:38] "GET /js/uikit.min.js HTTP/1.1" 200 132179 0.000000
12-09-2019 11:18:38 DEBUG:Initializing WebSocket
12-09-2019 11:18:38 DEBUG:Validating WebSocket request
12-09-2019 11:18:38 INFO:127.0.0.1 - - [2019-09-12 11:18:38] "GET /js/leaflet.js HTTP/1.1" 200 141315 0.000998
12-09-2019 11:18:38 DEBUG:Initializing WebSocket
12-09-2019 11:18:38 DEBUG:Validating WebSocket request
12-09-2019 11:18:38 INFO:127.0.0.1 - - [2019-09-12 11:18:38] "GET /eel.js HTTP/1.1" 200 4803 0.000998
12-09-2019 11:18:38 DEBUG:Initializing WebSocket
12-09-2019 11:18:38 DEBUG:Validating WebSocket request
12-09-2019 11:18:38 INFO:127.0.0.1 - - [2019-09-12 11:18:38] "GET /js/script-uikit.js HTTP/1.1" 200 12495 0.000997
12-09-2019 11:18:38 DEBUG:Initializing WebSocket
12-09-2019 11:18:38 DEBUG:Validating WebSocket request
12-09-2019 11:18:38 INFO:127.0.0.1 - - [2019-09-12 11:18:38] "GET /favicon.ico HTTP/1.1" 200 15261 0.020943
12-09-2019 11:18:38 DEBUG:Initializing WebSocket
12-09-2019 11:18:38 DEBUG:Validating WebSocket request
12-09-2019 11:18:38 INFO:127.0.0.1 - - [2019-09-12 11:18:38] "GET /css/images/marker-icon.png HTTP/1.1" 200 1637 0.019947
12-09-2019 11:18:38 DEBUG:Initializing WebSocket
12-09-2019 11:18:38 DEBUG:Validating WebSocket request
12-09-2019 11:18:38 INFO:127.0.0.1 - - [2019-09-12 11:18:38] "GET /css/images/marker-shadow.png HTTP/1.1" 200 788 0.001995
12-09-2019 11:18:38 DEBUG:Initializing WebSocket
12-09-2019 11:18:38 DEBUG:Validating WebSocket request
12-09-2019 11:18:38 DEBUG:Attempting to upgrade connection
12-09-2019 11:18:38 DEBUG:WebSocket request accepted, switching protocols
12-09-2019 11:18:47 DEBUG:Введенный кад. номер: 66161404005
12-09-2019 11:18:47 DEBUG:Ошибка(опечатка) в кадастровом номере!
12-09-2019 11:18:56 DEBUG:Введенный кад. номер: 6616140400543
12-09-2019 11:18:56 DEBUG:Starting new HTTP connection (1): pkk5.rosreestr.ru:80
12-09-2019 11:18:56 DEBUG:http://pkk5.rosreestr.ru:80 "POST /api/features/1/66:16:1404005:43 HTTP/1.1" 301 0
12-09-2019 11:18:56 DEBUG:Starting new HTTPS connection (1): pkk5.rosreestr.ru:443
12-09-2019 11:18:57 DEBUG:https://pkk5.rosreestr.ru:443 "GET /api/features/1/66:16:1404005:43 HTTP/1.1" 200 2204
12-09-2019 11:18:57 INFO:Кадастровый номер: 66:16:1404005:43
Адрес: Свердловская область, р-н Нижнесергинский, д. Половинка, ул. Грибная, д. 3
Координаты:
56,558717	59,185634
56°33ʹ31ʺ с.ш. 59°11ʹ08ʺ в.д.
Лист М 1:200000 : O-40-36

https://yandex.ru/maps/?mode=search&text=56.558717%2C59.185634

file://d:/OziExplorer/data/CADASTER.txt
Datum,WGS 84
WP,D,66:16:1404005:43,56.558717,59.185634,09/12/19,11/18/57,,D,N,-9999

12-09-2019 11:20:26 DEBUG:Адрес:Свердловская обл., Нижнесергинский р-н, д. Половинка, ул. Грибная, д. 3
12-09-2019 11:20:26 DEBUG:Папка с отчетом:Экопоселение Демид Нижнесергинский район ул. Грибная, д. 3 Сентябрь 2019
12-09-2019 12:26:02 DEBUG:Closed WebSocket
12-09-2019 12:26:03 DEBUG:Failed to write closing frame -> closing socket
12-09-2019 12:26:03 DEBUG:Closed WebSocket
12-09-2019 04:51:15 INFO:******************** Starting Cadastron v2.147 Build: 07-08-2019-08:59:17 ********************
12-09-2019 04:51:16 DEBUG:Initializing WebSocket
12-09-2019 04:51:16 DEBUG:Validating WebSocket request
12-09-2019 04:51:16 INFO:127.0.0.1 - - [2019-09-12 16:51:16] "GET /main-uikit.html HTTP/1.1" 200 9516 0.295222
12-09-2019 04:51:16 DEBUG:Initializing WebSocket
12-09-2019 04:51:16 DEBUG:Validating WebSocket request
12-09-2019 04:51:16 INFO:127.0.0.1 - - [2019-09-12 16:51:16] "GET /css/uikit.min.css HTTP/1.1" 200 253541 0.001996
12-09-2019 04:51:16 DEBUG:Initializing WebSocket
12-09-2019 04:51:16 DEBUG:Validating WebSocket request
12-09-2019 04:51:16 INFO:127.0.0.1 - - [2019-09-12 16:51:16] "GET /css/leaflet.css HTTP/1.1" 200 14292 0.002992
12-09-2019 04:51:16 DEBUG:Initializing WebSocket
12-09-2019 04:51:16 DEBUG:Validating WebSocket request
12-09-2019 04:51:16 INFO:127.0.0.1 - - [2019-09-12 16:51:16] "GET /css/main-uikit.css HTTP/1.1" 200 556 0.000998
12-09-2019 04:51:16 DEBUG:Initializing WebSocket
12-09-2019 04:51:16 DEBUG:Validating WebSocket request
12-09-2019 04:51:16 INFO:127.0.0.1 - - [2019-09-12 16:51:16] "GET /js/uikit.min.js HTTP/1.1" 200 132179 0.000998
12-09-2019 04:51:16 DEBUG:Initializing WebSocket
12-09-2019 04:51:16 DEBUG:Validating WebSocket request
12-09-2019 04:51:16 INFO:127.0.0.1 - - [2019-09-12 16:51:16] "GET /js/uikit-icons.min.js HTTP/1.1" 200 63621 0.000998
12-09-2019 04:51:16 DEBUG:Initializing WebSocket
12-09-2019 04:51:16 DEBUG:Validating WebSocket request
12-09-2019 04:51:16 INFO:127.0.0.1 - - [2019-09-12 16:51:16] "GET /js/jquery-3.3.1.min.js HTTP/1.1" 200 87114 0.000999
12-09-2019 04:51:16 DEBUG:Initializing WebSocket
12-09-2019 04:51:16 DEBUG:Validating WebSocket request
12-09-2019 04:51:16 INFO:127.0.0.1 - - [2019-09-12 16:51:16] "GET /js/leaflet.js HTTP/1.1" 200 141315 0.000997
12-09-2019 04:51:16 DEBUG:Initializing WebSocket
12-09-2019 04:51:16 DEBUG:Validating WebSocket request
12-09-2019 04:51:16 INFO:127.0.0.1 - - [2019-09-12 16:51:16] "GET /eel.js HTTP/1.1" 200 4803 0.000997
12-09-2019 04:51:16 DEBUG:Initializing WebSocket
12-09-2019 04:51:16 DEBUG:Validating WebSocket request
12-09-2019 04:51:16 INFO:127.0.0.1 - - [2019-09-12 16:51:16] "GET /js/script-uikit.js HTTP/1.1" 200 12495 0.000998
12-09-2019 04:51:16 DEBUG:Initializing WebSocket
12-09-2019 04:51:16 DEBUG:Validating WebSocket request
12-09-2019 04:51:16 INFO:127.0.0.1 - - [2019-09-12 16:51:16] "GET /favicon.ico HTTP/1.1" 200 15261 0.000997
12-09-2019 04:51:16 DEBUG:Initializing WebSocket
12-09-2019 04:51:16 DEBUG:Validating WebSocket request
12-09-2019 04:51:16 INFO:127.0.0.1 - - [2019-09-12 16:51:16] "GET /css/images/marker-icon.png HTTP/1.1" 200 1637 0.001008
12-09-2019 04:51:16 DEBUG:Initializing WebSocket
12-09-2019 04:51:16 DEBUG:Validating WebSocket request
12-09-2019 04:51:16 INFO:127.0.0.1 - - [2019-09-12 16:51:16] "GET /css/images/marker-shadow.png HTTP/1.1" 200 788 0.001996
12-09-2019 04:51:17 DEBUG:Initializing WebSocket
12-09-2019 04:51:17 DEBUG:Validating WebSocket request
12-09-2019 04:51:17 DEBUG:Attempting to upgrade connection
12-09-2019 04:51:17 DEBUG:WebSocket request accepted, switching protocols
12-09-2019 04:51:20 DEBUG:Введенный кад. номер: 6641030702110
12-09-2019 04:51:20 DEBUG:Starting new HTTP connection (1): pkk5.rosreestr.ru:80
12-09-2019 04:51:20 DEBUG:http://pkk5.rosreestr.ru:80 "POST /api/features/1/66:41:307021:10 HTTP/1.1" 301 0
12-09-2019 04:51:20 DEBUG:Starting new HTTPS connection (1): pkk5.rosreestr.ru:443
12-09-2019 04:51:20 DEBUG:https://pkk5.rosreestr.ru:443 "GET /api/features/1/66:41:307021:10 HTTP/1.1" 200 1508
12-09-2019 04:51:20 INFO:Кадастровый номер: 66:41:0307021:10
Адрес: обл. Свердловская, г. Екатеринбург,  к/с "Импульс", уч.10
Координаты:
56,85594 	60,366888
56°51ʹ21ʺ с.ш. 60°22ʹ00ʺ в.д.
Лист М 1:200000 : O-41-25

https://yandex.ru/maps/?mode=search&text=56.85594%2C60.366888

file://d:/OziExplorer/data/CADASTER.txt
Datum,WGS 84
WP,D,66:41:0307021:10,56.85594 ,60.366888,09/12/19,16/51/20,,D,N,-9999

12-09-2019 04:52:52 DEBUG:Адрес:Свердловская обл., г. Екатеринбург,  к/с <<Импульс>>, уч.10
12-09-2019 04:52:52 DEBUG:Папка с отчетом:Палкинский Торфяник,  к/с Импульс, уч.10 Сентябрь 2019
12-09-2019 04:56:18 DEBUG:Closed WebSocket
12-09-2019 04:56:19 DEBUG:Failed to write closing frame -> closing socket
12-09-2019 04:56:19 DEBUG:Closed WebSocket
13-09-2019 11:32:10 INFO:******************** Starting Cadastron v2.147 Build: 07-08-2019-08:59:17 ********************
13-09-2019 11:32:10 DEBUG:Initializing WebSocket
13-09-2019 11:32:10 DEBUG:Validating WebSocket request
13-09-2019 11:32:11 INFO:127.0.0.1 - - [2019-09-13 11:32:11] "GET /main-uikit.html HTTP/1.1" 200 9516 0.295208
13-09-2019 11:32:11 DEBUG:Initializing WebSocket
13-09-2019 11:32:11 DEBUG:Validating WebSocket request
13-09-2019 11:32:11 INFO:127.0.0.1 - - [2019-09-13 11:32:11] "GET /css/uikit.min.css HTTP/1.1" 200 253541 0.003989
13-09-2019 11:32:11 DEBUG:Initializing WebSocket
13-09-2019 11:32:11 DEBUG:Validating WebSocket request
13-09-2019 11:32:11 INFO:127.0.0.1 - - [2019-09-13 11:32:11] "GET /css/leaflet.css HTTP/1.1" 200 14292 0.001995
13-09-2019 11:32:11 DEBUG:Initializing WebSocket
13-09-2019 11:32:11 DEBUG:Validating WebSocket request
13-09-2019 11:32:11 INFO:127.0.0.1 - - [2019-09-13 11:32:11] "GET /css/main-uikit.css HTTP/1.1" 200 556 0.000998
13-09-2019 11:32:11 DEBUG:Initializing WebSocket
13-09-2019 11:32:11 DEBUG:Validating WebSocket request
13-09-2019 11:32:11 INFO:127.0.0.1 - - [2019-09-13 11:32:11] "GET /js/uikit-icons.min.js HTTP/1.1" 200 63621 0.000997
13-09-2019 11:32:11 DEBUG:Initializing WebSocket
13-09-2019 11:32:11 DEBUG:Validating WebSocket request
13-09-2019 11:32:11 INFO:127.0.0.1 - - [2019-09-13 11:32:11] "GET /js/jquery-3.3.1.min.js HTTP/1.1" 200 87114 0.000997
13-09-2019 11:32:11 DEBUG:Initializing WebSocket
13-09-2019 11:32:11 DEBUG:Validating WebSocket request
13-09-2019 11:32:11 INFO:127.0.0.1 - - [2019-09-13 11:32:11] "GET /js/uikit.min.js HTTP/1.1" 200 132179 0.000998
13-09-2019 11:32:11 DEBUG:Initializing WebSocket
13-09-2019 11:32:11 DEBUG:Validating WebSocket request
13-09-2019 11:32:11 INFO:127.0.0.1 - - [2019-09-13 11:32:11] "GET /js/leaflet.js HTTP/1.1" 200 141315 0.000997
13-09-2019 11:32:11 DEBUG:Initializing WebSocket
13-09-2019 11:32:11 DEBUG:Validating WebSocket request
13-09-2019 11:32:11 INFO:127.0.0.1 - - [2019-09-13 11:32:11] "GET /eel.js HTTP/1.1" 200 4803 0.000000
13-09-2019 11:32:11 DEBUG:Initializing WebSocket
13-09-2019 11:32:11 DEBUG:Validating WebSocket request
13-09-2019 11:32:11 INFO:127.0.0.1 - - [2019-09-13 11:32:11] "GET /js/script-uikit.js HTTP/1.1" 200 12495 0.000997
13-09-2019 11:32:11 DEBUG:Initializing WebSocket
13-09-2019 11:32:11 DEBUG:Validating WebSocket request
13-09-2019 11:32:11 INFO:127.0.0.1 - - [2019-09-13 11:32:11] "GET /favicon.ico HTTP/1.1" 200 15261 0.000997
13-09-2019 11:32:11 DEBUG:Initializing WebSocket
13-09-2019 11:32:11 DEBUG:Validating WebSocket request
13-09-2019 11:32:11 INFO:127.0.0.1 - - [2019-09-13 11:32:11] "GET /css/images/marker-icon.png HTTP/1.1" 200 1637 0.000997
13-09-2019 11:32:11 DEBUG:Initializing WebSocket
13-09-2019 11:32:11 DEBUG:Validating WebSocket request
13-09-2019 11:32:11 INFO:127.0.0.1 - - [2019-09-13 11:32:11] "GET /css/images/marker-shadow.png HTTP/1.1" 200 788 0.000998
13-09-2019 11:32:11 DEBUG:Initializing WebSocket
13-09-2019 11:32:11 DEBUG:Validating WebSocket request
13-09-2019 11:32:11 DEBUG:Attempting to upgrade connection
13-09-2019 11:32:11 DEBUG:WebSocket request accepted, switching protocols
13-09-2019 11:32:16 DEBUG:Введенный кад. номер: 66:58:1301002:1308
13-09-2019 11:32:16 DEBUG:Starting new HTTP connection (1): pkk5.rosreestr.ru:80
13-09-2019 11:32:16 DEBUG:http://pkk5.rosreestr.ru:80 "POST /api/features/1/66:58:1301002:1308 HTTP/1.1" 301 0
13-09-2019 11:32:16 DEBUG:Starting new HTTPS connection (1): pkk5.rosreestr.ru:443
13-09-2019 11:32:16 DEBUG:https://pkk5.rosreestr.ru:443 "GET /api/features/1/66:58:1301002:1308 HTTP/1.1" 200 2103
13-09-2019 11:32:16 INFO:Кадастровый номер: 66:58:1301002:1308
Адрес: Свердловская область, г Первоуральск, п Билимбай
Координаты:
56,984915	59,852961
56°59ʹ05ʺ с.ш. 59°51ʹ10ʺ в.д.
Лист М 1:200000 : O-40-30

https://yandex.ru/maps/?mode=search&text=56.984915%2C59.852961

file://d:/OziExplorer/data/CADASTER.txt
Datum,WGS 84
WP,D,66:58:1301002:1308,56.984915,59.852961,09/13/19,11/32/16,,D,N,-9999

13-09-2019 11:36:22 DEBUG:Closed WebSocket
13-09-2019 11:36:23 DEBUG:Failed to write closing frame -> closing socket
13-09-2019 11:36:23 DEBUG:Closed WebSocket
13-09-2019 02:59:25 INFO:******************** Starting Cadastron v2.147 Build: 07-08-2019-08:59:17 ********************
13-09-2019 02:59:26 DEBUG:Initializing WebSocket
13-09-2019 02:59:26 DEBUG:Validating WebSocket request
13-09-2019 02:59:26 INFO:127.0.0.1 - - [2019-09-13 14:59:26] "GET /main-uikit.html HTTP/1.1" 200 9516 0.299194
13-09-2019 02:59:26 DEBUG:Initializing WebSocket
13-09-2019 02:59:26 DEBUG:Validating WebSocket request
13-09-2019 02:59:26 INFO:127.0.0.1 - - [2019-09-13 14:59:26] "GET /css/uikit.min.css HTTP/1.1" 200 253541 0.004992
13-09-2019 02:59:26 DEBUG:Initializing WebSocket
13-09-2019 02:59:26 DEBUG:Validating WebSocket request
13-09-2019 02:59:26 INFO:127.0.0.1 - - [2019-09-13 14:59:26] "GET /css/leaflet.css HTTP/1.1" 200 14292 0.001990
13-09-2019 02:59:26 DEBUG:Initializing WebSocket
13-09-2019 02:59:26 DEBUG:Validating WebSocket request
13-09-2019 02:59:26 INFO:127.0.0.1 - - [2019-09-13 14:59:26] "GET /css/main-uikit.css HTTP/1.1" 200 556 0.001994
13-09-2019 02:59:26 DEBUG:Initializing WebSocket
13-09-2019 02:59:26 DEBUG:Validating WebSocket request
13-09-2019 02:59:26 INFO:127.0.0.1 - - [2019-09-13 14:59:26] "GET /js/uikit-icons.min.js HTTP/1.1" 200 63621 0.000998
13-09-2019 02:59:26 DEBUG:Initializing WebSocket
13-09-2019 02:59:26 DEBUG:Validating WebSocket request
13-09-2019 02:59:26 INFO:127.0.0.1 - - [2019-09-13 14:59:26] "GET /js/jquery-3.3.1.min.js HTTP/1.1" 200 87114 0.001009
13-09-2019 02:59:26 DEBUG:Initializing WebSocket
13-09-2019 02:59:26 DEBUG:Validating WebSocket request
13-09-2019 02:59:26 INFO:127.0.0.1 - - [2019-09-13 14:59:26] "GET /js/uikit.min.js HTTP/1.1" 200 132179 0.000985
13-09-2019 02:59:26 DEBUG:Initializing WebSocket
13-09-2019 02:59:26 DEBUG:Validating WebSocket request
13-09-2019 02:59:26 INFO:127.0.0.1 - - [2019-09-13 14:59:26] "GET /js/leaflet.js HTTP/1.1" 200 141315 0.000998
13-09-2019 02:59:26 DEBUG:Initializing WebSocket
13-09-2019 02:59:26 DEBUG:Validating WebSocket request
13-09-2019 02:59:26 INFO:127.0.0.1 - - [2019-09-13 14:59:26] "GET /eel.js HTTP/1.1" 200 4803 0.000000
13-09-2019 02:59:26 DEBUG:Initializing WebSocket
13-09-2019 02:59:26 DEBUG:Validating WebSocket request
13-09-2019 02:59:26 INFO:127.0.0.1 - - [2019-09-13 14:59:26] "GET /js/script-uikit.js HTTP/1.1" 200 12495 0.000000
13-09-2019 02:59:26 DEBUG:Initializing WebSocket
13-09-2019 02:59:26 DEBUG:Validating WebSocket request
13-09-2019 02:59:26 INFO:127.0.0.1 - - [2019-09-13 14:59:26] "GET /favicon.ico HTTP/1.1" 200 15261 0.000996
13-09-2019 02:59:26 DEBUG:Initializing WebSocket
13-09-2019 02:59:26 DEBUG:Validating WebSocket request
13-09-2019 02:59:26 INFO:127.0.0.1 - - [2019-09-13 14:59:26] "GET /css/images/marker-icon.png HTTP/1.1" 200 1637 0.001994
13-09-2019 02:59:26 DEBUG:Initializing WebSocket
13-09-2019 02:59:26 DEBUG:Validating WebSocket request
13-09-2019 02:59:26 INFO:127.0.0.1 - - [2019-09-13 14:59:26] "GET /css/images/marker-shadow.png HTTP/1.1" 200 788 0.001996
13-09-2019 02:59:26 DEBUG:Initializing WebSocket
13-09-2019 02:59:26 DEBUG:Validating WebSocket request
13-09-2019 02:59:26 DEBUG:Attempting to upgrade connection
13-09-2019 02:59:26 DEBUG:WebSocket request accepted, switching protocols
13-09-2019 02:59:31 DEBUG:Введенный кад. номер: 66:62:0301002:185
13-09-2019 02:59:31 DEBUG:Starting new HTTP connection (1): pkk5.rosreestr.ru:80
13-09-2019 02:59:31 DEBUG:http://pkk5.rosreestr.ru:80 "POST /api/features/1/66:62:301002:185 HTTP/1.1" 301 0
13-09-2019 02:59:31 DEBUG:Starting new HTTPS connection (1): pkk5.rosreestr.ru:443
13-09-2019 02:59:31 DEBUG:https://pkk5.rosreestr.ru:443 "GET /api/features/1/66:62:301002:185 HTTP/1.1" 200 1349
13-09-2019 02:59:31 INFO:Кадастровый номер: 66:62:0301002:185
Адрес: обл. Свердловская, г. Среднеуральск, д. Коптяки, ул. Родниковая, дом 9.
Координаты:
56,964944	60,433652
56°57ʹ53ʺ с.ш. 60°26ʹ01ʺ в.д.
Лист М 1:200000 : O-41-25

https://yandex.ru/maps/?mode=search&text=56.964944%2C60.433652

file://d:/OziExplorer/data/CADASTER.txt
Datum,WGS 84
WP,D,66:62:0301002:185,56.964944,60.433652,09/13/19,14/59/31,,D,N,-9999

13-09-2019 03:00:20 DEBUG:Адрес:Свердловская обл., г. Среднеуральск, д. Коптяки, ул. Озерная, дом 12
13-09-2019 03:00:20 DEBUG:Папка с отчетом:Коптяки, ул. Озерная, 2 Сентябрь 2019
13-09-2019 03:03:09 DEBUG:Closed WebSocket
13-09-2019 03:03:10 DEBUG:Failed to write closing frame -> closing socket
13-09-2019 03:03:10 DEBUG:Closed WebSocket
16-09-2019 09:26:40 INFO:******************** Starting Cadastron v2.147 Build: 07-08-2019-08:59:17 ********************
16-09-2019 09:26:41 DEBUG:Initializing WebSocket
16-09-2019 09:26:41 DEBUG:Validating WebSocket request
16-09-2019 09:26:41 INFO:127.0.0.1 - - [2019-09-16 09:26:41] "GET /main-uikit.html HTTP/1.1" 200 9516 0.337059
16-09-2019 09:26:41 DEBUG:Initializing WebSocket
16-09-2019 09:26:41 DEBUG:Validating WebSocket request
16-09-2019 09:26:41 INFO:127.0.0.1 - - [2019-09-16 09:26:41] "GET /css/uikit.min.css HTTP/1.1" 200 253541 0.017962
